,text,rating_numerator,rating_denominator,name,doggo,floofer,pupper,puppo,stage,year,month,day,time,retweet_count,favorite_count,jpg_url,img_num,p1,p1_conf,p1_dog,p2,p2_conf,p2_dog,p3,p3_conf,p3_dog,dog_type
1226,"""Dammit hooman I'm jus trynna lik the fler"" 11/10 https://t.co/eRZRI8OTj7",11.0,10.0,None,,,,,,2015,12,24,03:12:15,706,2678,https://pbs.twimg.com/media/CW9a_h1WwAApmAy.jpg,1,EntleBucher,0.5232060000000001,True,Greater_Swiss_Mountain_dog,0.4316569999999999,True,Appenzeller,0.0442079,True,EntleBucher
1227,This is Bruce. He's a rare pup. Covered in Frosted Flakes. Nifty gold teeth. Overall good dog. 7/10 would pet firmly https://t.co/RtxxACzZ8A,7.0,10.0,Bruce,,,,,,2015,12,24,02:42:51,1402,3143,https://pbs.twimg.com/media/CW9UQ7oWkAAErmU.jpg,1,llama,0.887963,False,ram,0.0950207,False,chow,0.00230739,True,chow
1228,This is Willie. He's floating away and needs your assistance. Please someone help Willie. 10/10 https://t.co/MJqygWqt8X,10.0,10.0,Willie,,,,,,2015,12,24,02:02:12,887,2593,https://pbs.twimg.com/media/CW9K9VeVAAE0j-x.jpg,1,Airedale,0.903832,True,Border_terrier,0.0347125999999999,True,toy_poodle,0.021378,True,Airedale
1229,This is Rinna. She's melting. 10/10 get inside pupper https://t.co/PA0czwucsb,10.0,10.0,Rinna,,,pupper,,pupper,2015,12,23,21:37:40,1281,3390,https://pbs.twimg.com/media/CW8OYajUMAAPRoF.jpg,1,bloodhound,0.5288189999999999,True,bull_mastiff,0.4201189999999999,True,French_bulldog,0.00948059,True,bloodhound
1230,This pup's name is Sabertooth (parents must be cool). Ears for days. Jumps unannounced. 9/10 would pet diligently https://t.co/iazoiNUviP,9.0,10.0,None,,,,,,2015,12,23,18:51:56,918,2311,https://pbs.twimg.com/media/CW7oelWWcAAhyzz.jpg,1,French_bulldog,0.319139,True,Chihuahua,0.154088,True,Cardigan,0.117688,True,French_bulldog
1231,This is Hunter. He was playing with his ball minding his own business. Has no idea what happened to the carpet. 8/10 https://t.co/DbUTDI3u1R,8.0,10.0,Hunter,,,,,,2015,12,23,18:25:38,937,2367,https://pbs.twimg.com/media/CW7iddWUsAElUC0.jpg,1,wallaby,0.164215,False,West_Highland_white_terrier,0.0935148,True,ashcan,0.0672783,False,West_Highland_white_terrier
1232,This is Mike. He is a Jordanian Frito Pilates. Frowning because he can't see directly in front of him. 8/10 https://t.co/NL5QJwdEpF,8.0,10.0,Mike,,,,,,2015,12,23,17:55:32,539,1817,https://pbs.twimg.com/media/CW7bkW6WQAAksgB.jpg,1,boxer,0.459604,True,Boston_bull,0.197913,True,French_bulldog,0.0870225,True,boxer
1233,Guys this really needs to stop. We've been over this way too many times. This is a giraffe. We only rate dogs.. 7/10 https://t.co/yavgkHYPOC,7.0,10.0,a,,,,,,2015,12,23,05:13:38,2347,5208,https://pbs.twimg.com/media/CW4tL1vWcAIw1dw.jpg,1,dalmatian,0.750256,True,jaguar,0.169007,False,zebra,0.00648149,False,dalmatian
1234,Say hello to William. He makes fun of others because he's terrified of his own deep-seated insecurities. 7/10 https://t.co/bwuV6FlRxr,7.0,10.0,William,,,,,,2015,12,23,03:58:25,1461,3711,https://pbs.twimg.com/media/CW4b-GUWYAAa8QO.jpg,1,Chihuahua,0.761972,True,black-footed_ferret,0.150605,False,squirrel_monkey,0.0281479,False,Chihuahua
1235,This is Evy. She doesn't want to be a Koala. 9/10 https://t.co/VITeF0Kl9L,9.0,10.0,Evy,,,,,,2015,12,23,01:37:45,728,2304,https://pbs.twimg.com/media/CW37xZbUoAAUXe5.jpg,1,Maltese_dog,0.145742,True,toy_poodle,0.139407,True,West_Highland_white_terrier,0.108821,True,Maltese_dog
1236,Meet Hurley. He's the curly one. He hugs every other dog he sees during his walk. 11/10 for spreading the love https://t.co/M6vqkt2GKV,11.0,10.0,Hurley,,,,,,2015,12,23,00:45:35,21324,34856,https://pbs.twimg.com/media/CW3v1KxW8AAIOuy.jpg,1,toy_poodle,0.62178,True,miniature_poodle,0.197819,True,soft-coated_wheaten_terrier,0.046745,True,toy_poodle
1237,I know everyone's excited for Christmas but that doesn't mean you can send in reindeer. We only rate dogs... 8/10 https://t.co/eWjWgbOCYL,8.0,10.0,None,,,,,,2015,12,22,03:57:37,1163,3028,https://pbs.twimg.com/media/CWzSMmAWsAAyB1u.jpg,1,Italian_greyhound,0.302685,True,hair_slide,0.1242809999999999,False,Afghan_hound,0.059846,True,Italian_greyhound
1238,This is Louis. He's a river dancer. His friends think it's badass. All are very supportive. 10/10 for Louis https://t.co/qoIvjKMY58,10.0,10.0,Louis,,,,,,2015,12,22,02:52:45,1314,3253,https://pbs.twimg.com/media/CWzDWOkXAAAP0k7.jpg,1,Scottish_deerhound,0.1946099999999999,True,Irish_wolfhound,0.162855,True,giant_schnauzer,0.1598369999999999,True,Scottish_deerhound
1239,This is officially the greatest yawn of all time. 12/10 https://t.co/4R0Cc0sLVE,12.0,10.0,officially,,,,,,2015,12,22,01:28:25,2893,6514,https://pbs.twimg.com/ext_tw_video_thumb/679111114081370114/pu/img/hFca8BHjRopgD0cM.jpg,1,kelpie,0.189423,True,beagle,0.121988,True,basset,0.121171,True,kelpie
1240,This dog doesn't know how to stairs. Quite tragic really. 9/10 get it together pup https://t.co/kTpr9PTMg1,9.0,10.0,None,,,,,,2015,12,21,21:15:11,781,2460,https://pbs.twimg.com/media/CWx2FaLWcAEQ3vh.jpg,1,panpipe,0.962572,False,bannister,0.0252482,False,golden_retriever,0.00293035,True,golden_retriever
1241,If your Monday isn't going so well just take a look at this. Both 12/10 https://t.co/GJT6SILPGU,12.0,10.0,None,,,,,,2015,12,21,17:33:48,1333,2537,https://pbs.twimg.com/media/CWxDaXHWsAAWV8W.jpg,1,Eskimo_dog,0.330216,True,Siberian_husky,0.187003,True,Chihuahua,0.10142,True,Eskimo_dog
1242,Meet Lola. She's a Metamorphic Chartreuse. Plays with her food. Insubordinate and churlish. Exquisite hardwood 11/10 https://t.co/etpBNXwN7f,11.0,10.0,Lola,,,,,,2015,12,21,16:04:13,528,1796,https://pbs.twimg.com/media/CWwu6OLUkAEo3gq.jpg,1,Labrador_retriever,0.680251,True,Chesapeake_Bay_retriever,0.201697,True,golden_retriever,0.0196759,True,Labrador_retriever
1243,Here's a pupper with some mean tan lines. Snazzy sweater though 12/10 https://t.co/DpCSVsl6vu,12.0,10.0,None,,,pupper,,pupper,2015,12,21,04:52:53,1018,2810,https://pbs.twimg.com/media/CWuVQSLW4AAI3w9.jpg,1,Labrador_retriever,0.213673,True,beagle,0.146235,True,Airedale,0.122701,True,Labrador_retriever
1244,This is Linda. She fucking hates trees. 7/10 https://t.co/blaY85FIxR,7.0,10.0,Linda,,,,,,2015,12,21,04:44:55,1350,3804,https://pbs.twimg.com/media/CWuTbAKUsAAvZHh.jpg,1,Airedale,0.583122,True,silky_terrier,0.129567,True,Lakeland_terrier,0.0947266,True,Airedale
1245,This is Tug. He's not required to wear the cone he just wants his voice to project more clearly. 11/10 https://t.co/Sp739Ou2qx,11.0,10.0,Tug,,,,,,2015,12,21,03:12:08,1043,3037,https://pbs.twimg.com/media/CWt-MNIWEAAUC9S.jpg,1,Pembroke,0.194681,True,toy_poodle,0.121821,True,Pomeranian,0.096843,True,Pembroke
1246,"Meet Wilson. He got caught humping the futon. He's like ""dude, help me out here"" 10/10 I'd help Wilson out https://t.co/m6XoclB0qv",10.0,10.0,Wilson,,,,,,2015,12,21,02:30:45,544,1788,https://pbs.twimg.com/media/CWt0ubZWcAAkFER.jpg,1,Irish_terrier,0.696646,True,Australian_terrier,0.0749616,True,Irish_setter,0.0639011999999999,True,Irish_terrier
1247,This is Dash. He didn't think the water would be that cold. Damn it Dash it's December. Think a little. 10/10 https://t.co/NqcOwG8pxW,10.0,10.0,Dash,,,,,,2015,12,21,01:53:54,3741,7802,https://pbs.twimg.com/media/CWtsSQAUkAAnWws.jpg,1,malamute,0.606654,True,Border_collie,0.193831,True,collie,0.0483781,True,malamute
1248,Meet Tango. He's a large dog. Doesn't care much for personal space. Owner isn't very accepting. Tongue slip. 6/10 https://t.co/p2T5kGebxe,6.0,10.0,Tango,,,,,,2015,12,21,00:53:29,1926,4099,https://pbs.twimg.com/media/CWtede2WIAAF_AJ.jpg,1,seat_belt,0.7871640000000001,False,sunglasses,0.0457386999999999,False,beagle,0.0225251,True,beagle
1249,Meet Grizz. He just arrived. Couldn't wait until Christmas. Worried bc he saw the swastikas on the carpet. 10/10 https://t.co/QBGwYrT7rv,10.0,10.0,Grizz,,,,,,2015,12,20,18:29:43,489,2250,https://pbs.twimg.com/media/CWsGnyMVEAAM1Y1.jpg,1,Labrador_retriever,0.338757,True,flat-coated_retriever,0.3044699999999999,True,chest,0.0933923,False,Labrador_retriever
1250,Touching scene here. Really stirs up the emotions. The bond between father &amp; son. So beautiful. 10/10 for both pups https://t.co/AJWJHov5gx,10.0,10.0,None,,,,,,2015,12,20,05:25:42,1785,4358,https://pbs.twimg.com/media/CWpTLOYWsAEDhcU.jpg,1,Staffordshire_bullterrier,0.284492,True,Rottweiler,0.189434,True,American_Staffordshire_terrier,0.18943,True,Staffordshire_bullterrier
1251,This is Crystal. She's a shitty fireman. No sense of urgency. People could be dying Crystal. 2/10 just irresponsible https://t.co/rtMtjSl9pz,2.0,10.0,Crystal,,,,,,2015,12,20,03:58:55,2880,5916,https://pbs.twimg.com/media/CWo_T8gW4AAgJNo.jpg,1,Maltese_dog,0.759945,True,toy_poodle,0.101194,True,Shih-Tzu,0.0560374,True,Maltese_dog
1252,Say hello to Jerome. He can shoot french fries out of his mouth at insane speeds. Deadly af. 10/10 https://t.co/dIy88HwrX8,10.0,10.0,Jerome,,,,,,2015,12,20,03:02:53,2072,4640,https://pbs.twimg.com/media/CWoyfMiWUAAmGdd.jpg,1,schipperke,0.145877,True,Labrador_retriever,0.0983538,True,kelpie,0.0973933999999999,True,schipperke
1253,This made my day. 12/10 please enjoy https://t.co/VRTbo3aAcm,12.0,10.0,None,,,,,,2015,12,20,02:20:55,30742,61794,https://pbs.twimg.com/ext_tw_video_thumb/678399528077250560/pu/img/BOjUNHRsYLeSo0hl.jpg,1,swing,0.929196,False,Bedlington_terrier,0.0150472,True,Great_Pyrenees,0.0140389,True,Bedlington_terrier
1254,These little fellas have opposite facial expressions. Both 12/10 https://t.co/LmThv0GWen,12.0,10.0,None,,,,,,2015,12,20,02:09:34,478,1731,https://pbs.twimg.com/media/CWomSU_XIAAUYiK.jpg,2,Pembroke,0.95618,True,Cardigan,0.0318031,True,Chihuahua,0.0062765,True,Pembroke
1255,"This is Bella. She just learned that her final grade in chem was a 92.49 
poor pupper 11/10 https://t.co/auOoKuoveM",11.0,10.0,Bella,,,pupper,,pupper,2015,12,20,01:38:42,473,2044,https://pbs.twimg.com/media/CWofOHUWUAACGVa.jpg,1,miniature_pinscher,0.516284,True,kelpie,0.227402,True,vizsla,0.103246,True,miniature_pinscher
1256,This is Crumpet. He underestimated the snow. Quickly retreating. 10/10 https://t.co/a0Zx5LDFZa,10.0,10.0,Crumpet,,,,,,2015,12,20,01:03:46,1020,2655,https://pbs.twimg.com/media/CWoXOfSUAAA4u8g.jpg,1,dogsled,0.08854,False,snowmobile,0.0572909999999999,False,Samoyed,0.0476014,True,Samoyed
1257,This pupper likes tape. 12/10 https://t.co/cSp6w5GWgm,12.0,10.0,None,,,pupper,,pupper,2015,12,19,22:28:09,612,1896,https://pbs.twimg.com/media/CWnznDTU4AAa-6P.jpg,1,golden_retriever,0.853284,True,cocker_spaniel,0.0262298,True,Labrador_retriever,0.0241227999999999,True,golden_retriever
1258,This is Rosie. She has a snazzy bow tie and a fin for a tail. Probably super fast underwater. Cool socks 10/10 https://t.co/GO76MdGBs0,10.0,10.0,Rosie,,,,,,2015,12,19,22:02:01,304,1427,https://pbs.twimg.com/media/CWntoDVWcAEl3NB.jpg,1,Norfolk_terrier,0.378643,True,golden_retriever,0.0955939,True,kelpie,0.0853092,True,Norfolk_terrier
1259,Another spooky pupper here. Most definitely floating. No legs. Probably knows some dark magic. 10/10 very spooked https://t.co/JK8MByRzgj,10.0,10.0,None,,,pupper,,pupper,2015,12,19,18:19:51,6857,12531,https://pbs.twimg.com/media/CWm6xySUEAAqfFU.jpg,1,Maltese_dog,0.897841,True,Lhasa,0.0357175,True,Tibetan_terrier,0.0171074999999999,True,Maltese_dog
1260,This is Jessifer. She is a Bismoth Teriyaki. Flowers being attacked by hurricanes on bandana (rad). 9/10 stellar pup https://t.co/nZhmRwZzWv,9.0,10.0,Jessifer,,,,,,2015,12,19,16:47:58,418,1726,https://pbs.twimg.com/media/CWmlvxJU4AEAqaN.jpg,1,Chihuahua,0.613819,True,Yorkshire_terrier,0.127931,True,Pomeranian,0.0621243,True,Chihuahua
1261,This is Reese. He likes holding hands. 12/10 https://t.co/cbLroGCbmh,12.0,10.0,Reese,,,,,,2015,12,19,01:16:45,7148,15018,https://pbs.twimg.com/media/CWjQm5gXAAA9GkD.jpg,1,miniature_pinscher,0.822048,True,Doberman,0.0960845,True,Rottweiler,0.0327093,True,miniature_pinscher
1262,"""Everything looks pretty good in there. Make sure to brush your gums. Been flossing? How's school going?"" Both 10/10 https://t.co/lWL2IMJqLR",10.0,10.0,None,,,,,,2015,12,18,18:29:07,463,1476,https://pbs.twimg.com/media/CWhzTbzWUAAEAUN.jpg,1,Eskimo_dog,0.199347,True,dalmatian,0.153225,True,American_Staffordshire_terrier,0.107798,True,Eskimo_dog
1263,Guys this was terrifying. Really spooked me up. We don't rate ghosts. We rate dogs. Please only send dogs... 9/10 https://t.co/EJImi1udYb,9.0,10.0,None,,,,,,2015,12,18,16:56:01,2384,5275,https://pbs.twimg.com/media/CWhd_7WWsAAaqWG.jpg,1,dalmatian,0.550702,True,kuvasz,0.0602264,True,Great_Pyrenees,0.0586309999999999,True,dalmatian
1264,IT'S PUPPERGEDDON. Total of 144/120 ...I think https://t.co/ZanVtAtvIq,144.0,120.0,None,,,,,,2015,12,18,05:06:23,1104,3323,https://pbs.twimg.com/media/CWe7kw9W4AE8UJh.jpg,1,teddy,0.6629079999999999,False,crib,0.0318912,False,chow,0.0254378,True,chow
1265,This is Ralph. He's an interpretive dancer. 10/10 https://t.co/zoDdPyPFsa,10.0,10.0,Ralph,,,,,,2015,12,18,04:00:46,1622,3689,https://pbs.twimg.com/media/CWesj06W4AAIKl8.jpg,1,Siberian_husky,0.120849,True,junco,0.0792056,False,malamute,0.0630875,True,Siberian_husky
1266,This is Sadie. She got her holidays confused. 9/10 damn it Sadie https://t.co/fm7HxOsuPK,9.0,10.0,Sadie,,,,,,2015,12,18,03:54:25,363,1332,https://pbs.twimg.com/media/CWerGmOXAAAm6NY.jpg,1,Shih-Tzu,0.916645,True,Lhasa,0.0578834,True,Pekinese,0.0201258,True,Shih-Tzu
1267,This was Cindy's face when she heard Susan forgot the snacks for after the kid's soccer game. 11/10 https://t.co/gzkuVGRgAD,11.0,10.0,None,,,,,,2015,12,18,03:11:30,950,2681,https://pbs.twimg.com/media/CWehRdEWIAAySyO.jpg,1,Pembroke,0.573047,True,sunglasses,0.1267579999999999,False,golden_retriever,0.108047,True,Pembroke
1268,Endangered triangular pup here. Could be a wizard. Caught mid-laugh. No legs. Just fluff. Probably a wizard. 9/10 https://t.co/GFVIHIod0Z,9.0,10.0,None,,,,,,2015,12,18,02:17:22,1677,3603,https://pbs.twimg.com/media/CWeU5LBWEAA8F0J.jpg,1,Maltese_dog,0.817908,True,Angora,0.0778051,False,Pomeranian,0.0221842,True,Maltese_dog
1269,This is a dog swinging. I really enjoyed it so I hope you all do as well. 11/10 https://t.co/Ozo9KHTRND,11.0,10.0,a,,,,,,2015,12,18,00:18:36,886,2040,https://pbs.twimg.com/ext_tw_video_thumb/677644010865999872/pu/img/zVHEMYnJKzq1SauT.jpg,1,Chihuahua,0.626236,True,Italian_greyhound,0.1284829999999999,True,swing,0.0598404,False,Chihuahua
1270,Contortionist pup here. Inside pentagram. Clearly worships Satan. Known to slowly push fragile stuff off tables 6/10 https://t.co/EX9oR55VMe,6.0,10.0,None,,,,,,2015,12,17,19:07:09,513,1409,https://pbs.twimg.com/media/CWcybBmWcAAigAQ.jpg,1,basset,0.397295,True,Welsh_springer_spaniel,0.199554,True,purse,0.105641,False,basset
1271,Reckless pupper here. Not even looking at road. Absolute menace. No regard for fellow pupper lives. 10/10 still cute https://t.co/96IBkOYB7j,10.0,10.0,None,,,pupper,,pupper,2015,12,17,18:34:46,1322,2665,https://pbs.twimg.com/media/CWcrAVQWEAA6QMp.jpg,1,seat_belt,0.277257,False,Shih-Tzu,0.249017,True,Pekinese,0.209213,True,Shih-Tzu
1272,Not much to say here. I just think everyone needs to see this. 12/10 https://t.co/AGag0hFHpe,12.0,10.0,None,,,,,,2015,12,17,17:56:29,4076,7568,https://pbs.twimg.com/media/CWciPonWEAUOqLD.jpg,1,American_Staffordshire_terrier,0.914978,True,Staffordshire_bullterrier,0.0843952999999999,True,boxer,0.000461663,True,American_Staffordshire_terrier
1273,Say hello to Axel. He's a Black Chevy Pinot on wheels. 0 to 60 in 5.7 seconds (if downhill). 9/10 I call shotgun https://t.co/DKe9DBnnHE,9.0,10.0,Axel,,,,,,2015,12,17,16:45:31,250,1161,https://pbs.twimg.com/media/CWcSAI-WUAAOB9W.jpg,1,Staffordshire_bullterrier,0.6892590000000001,True,Norwegian_elkhound,0.026121,True,American_Staffordshire_terrier,0.0230747,True,Staffordshire_bullterrier
1274,This dog gave up mid jump. 9/10 https://t.co/KmMv3Y2zI8,9.0,10.0,None,,,,,,2015,12,17,03:48:51,328,1477,https://pbs.twimg.com/media/CWZgPPUWUAAUOvu.jpg,2,Lakeland_terrier,0.859392,True,Airedale,0.0672917,True,Irish_water_spaniel,0.0495306,True,Lakeland_terrier
1275,Meet Humphrey. He's a Northern Polyp Viagra. One ear works. Face stuck like that. Always surprised. 9/10 petable af https://t.co/FS7eJQM2F4,9.0,10.0,Humphrey,,,,,,2015,12,17,03:36:28,265,1189,https://pbs.twimg.com/media/CWZdaGxXAAAjGjb.jpg,1,beagle,0.3134639999999999,True,boxer,0.218503,True,French_bulldog,0.1064619999999999,True,beagle
1276,This is Derek. All the dogs adore Derek. He's a great guy. 10/10 really solid pup https://t.co/KgcsGNb61s,10.0,10.0,Derek,,,,,,2015,12,17,03:26:04,1693,3938,https://pbs.twimg.com/media/CWZbBlAUsAAjRg5.jpg,1,water_buffalo,0.42425,False,kelpie,0.0290541,True,Staffordshire_bullterrier,0.0284697,True,kelpie
1277,"Meet Tassy &amp; Bee. Tassy is pretty chill, but Bee is convinced the Ruffles are haunted. 10/10 &amp; 11/10 respectively https://t.co/fgORpmTN9C",10.0,10.0,Tassy,,,,,,2015,12,17,02:30:09,611,1799,https://pbs.twimg.com/media/CWZOOIUW4AAQrX_.jpg,2,Blenheim_spaniel,0.924127,True,Japanese_spaniel,0.0547900999999999,True,Chihuahua,0.00820404,True,Blenheim_spaniel
1278,This is Juckson. He's totally on his way to a nascar race. 5/10 for Juckson https://t.co/IoLRvF0Kak,5.0,10.0,Juckson,,,,,,2015,12,17,01:35:24,471,1362,https://pbs.twimg.com/media/CWZBsjPWsAAZFFl.jpg,1,Japanese_spaniel,0.6611779999999999,True,Pekinese,0.150119,True,Chihuahua,0.11972,True,Japanese_spaniel
1279,This is the happiest pupper I've ever seen. 10/10 would trade lives with https://t.co/ep8ATEJwRb,10.0,10.0,the,,,pupper,,pupper,2015,12,16,23:29:14,790,2164,https://pbs.twimg.com/media/CWYk0WxWoAAEwRt.jpg,1,Shetland_sheepdog,0.656616,True,collie,0.195405,True,German_shepherd,0.0131032,True,Shetland_sheepdog
1280,Here we see a Byzantine Rigatoni. Very aerodynamic. No eyes. Actually not windy here they just look like that. 9/10 https://t.co/gzI0m6wXRo,9.0,10.0,None,,,,,,2015,12,16,18:03:28,1033,2981,https://pbs.twimg.com/media/CWXaQMBWcAAATDi.jpg,1,English_setter,0.282396,True,Shih-Tzu,0.0841118999999999,True,Old_English_sheepdog,0.059538,True,English_setter
1281,This is Cooper. He doesn't know how cheese works. Likes the way it feels on his face. Cheeky tongue slip. 11/10 https://t.co/j1zczS0lI5,11.0,10.0,Cooper,,,,,,2015,12,16,04:01:59,1203,3015,https://pbs.twimg.com/media/CWUZpydWcAAeipD.jpg,1,malamute,0.363257,True,Siberian_husky,0.245862,True,Eskimo_dog,0.125547,True,malamute
1282,10/10 I'd follow this dog into battle no questions asked https://t.co/ngTNXYQF0L,10.0,10.0,None,,,,,,2015,12,16,02:51:45,907,2395,https://pbs.twimg.com/ext_tw_video_thumb/676957802976419840/pu/img/dCj-qlXo73A5hf6Q.jpg,1,Labrador_retriever,0.772423,True,beagle,0.0559016999999999,True,golden_retriever,0.0311519,True,Labrador_retriever
1283,This is Tyrus. He's a Speckled Centennial Ticonderoga. Terrified of floating red ball. Nifty bandana. 8/10 v petable https://t.co/HqM3YhCaaa,8.0,10.0,Tyrus,,,,,,2015,12,16,02:19:04,448,1413,https://pbs.twimg.com/media/CWUCGMtWEAAjXnS.jpg,1,Welsh_springer_spaniel,0.206479,True,Saint_Bernard,0.139339,True,boxer,0.114606,True,Welsh_springer_spaniel
1284,This pups goal was to get all four feet as close to each other as possible. Valiant effort 12/10 https://t.co/2mXALbgBTV,12.0,10.0,None,,,,,,2015,12,16,02:08:04,426,1844,https://pbs.twimg.com/media/CWT_lOQWUAAXPaY.jpg,1,Pekinese,0.752707,True,golden_retriever,0.0556545999999999,True,Great_Pyrenees,0.0410178,True,Pekinese
1285,Here we see a rare pouched pupper. Ample storage space. Looks alert. Jumps at random. Kicked open that door. 8/10 https://t.co/mqvaxleHRz,8.0,10.0,None,,,pupper,,pupper,2015,12,16,01:27:03,5515,13809,https://pbs.twimg.com/media/CWT2MUgWIAECWig.jpg,1,Chesapeake_Bay_retriever,0.5452859999999999,True,Norwegian_elkhound,0.081482,True,space_heater,0.0473911,False,Chesapeake_Bay_retriever
1286,Meet Ash. He's just a head now. Lost his body during the Third Crusade. Still in good spirits. 10/10 would pet well https://t.co/NJj2uP0atK,10.0,10.0,Ash,,,,,,2015,12,15,20:40:47,808,2294,https://pbs.twimg.com/media/CWS0q8iU8AE2Srr.jpg,1,Chesapeake_Bay_retriever,0.371146,True,water_buffalo,0.0995963,False,Weimaraner,0.0489679,True,Chesapeake_Bay_retriever
1287,Finally some constructive political change in this country. 11/10 https://t.co/mvQaETHVSb,11.0,10.0,None,,,,,,2015,12,15,17:51:44,17605,25124,https://pbs.twimg.com/media/CWSN-vaXAAA8Ehr.jpg,2,Great_Pyrenees,0.8698040000000001,True,kuvasz,0.0798143,True,standard_poodle,0.0132629999999999,True,Great_Pyrenees
1288,Watch out Airbud. This pupper is also good at the sports. 12/10 I'm thinking D1 https://t.co/1HrFdo7M0C,12.0,10.0,None,,,pupper,,pupper,2015,12,15,17:42:34,741,1957,https://pbs.twimg.com/media/CWSL4W8WsAAE4KU.jpg,2,rain_barrel,0.625555,False,barrel,0.138383,False,Labrador_retriever,0.0394645999999999,True,Labrador_retriever
1289,Say hello to Penny &amp; Gizmo. They are practicing their caroling. The ambition in the room is tangible. 9/10 for both https://t.co/aqBHjjh5VD,9.0,10.0,Penny,,,,,,2015,12,15,17:11:09,469,1536,https://pbs.twimg.com/media/CWSEsO9WwAAX-fZ.jpg,1,Chihuahua,0.440916,True,Pomeranian,0.345806,True,cocker_spaniel,0.0603312,True,Chihuahua
1290,I promise this wasn't meant to be a cuteness overload account but ermergerd look at this cozy pupper. 13/10 https://t.co/mpQl2rJjDh,13.0,10.0,None,,,pupper,,pupper,2015,12,15,04:19:18,1108,3149,https://pbs.twimg.com/media/CWPUB9TWwAALPPx.jpg,1,Chihuahua,0.841084,True,Pomeranian,0.12053,True,Pekinese,0.00660034,True,Chihuahua
1291,This is the saddest/sweetest/best picture I've been sent. 12/10 ðŸ˜¢ðŸ¶ https://t.co/vQ2Lw1BLBF,12.0,10.0,the,,,,,,2015,12,15,04:05:01,219,1183,https://pbs.twimg.com/media/CWPQwmJWUAAu_At.jpg,1,book_jacket,0.4937899999999999,False,Doberman,0.0964228,True,miniature_pinscher,0.0706466999999999,True,Doberman
1292,*screeches for a sec and then faints* 12/10 https://t.co/N5QL4ySBEx,12.0,10.0,None,,,,,,2015,12,15,03:36:42,490,2039,https://pbs.twimg.com/media/CWPKSGpWcAQN6mw.jpg,1,Loafer,0.202999,False,doormat,0.2004109999999999,False,malinois,0.1423,True,malinois
1293,This is Godzilla pupper. He had a ruff childhood &amp; now deflects that pain outward by terrorizing cities. Tragic 9/10 https://t.co/g1tLGkyaxr,9.0,10.0,Godzilla,,,pupper,,pupper,2015,12,15,03:23:14,440,1280,https://pbs.twimg.com/media/CWPHMqKVAAAE78E.jpg,1,whippet,0.8770209999999999,True,Great_Dane,0.0341819,True,boxer,0.028404,True,whippet
1294,This is Bubbles. He kinda resembles a fish. Always makes eye contact with u no matter what. Sneaky tongue slip. 5/10 https://t.co/Nrhvc5tLFT,5.0,10.0,Bubbles,,,,,,2015,12,15,02:23:26,896,2533,https://pbs.twimg.com/media/CWO5gmCUYAAX4WA.jpg,1,Boston_bull,0.976577,True,French_bulldog,0.0143237,True,Chihuahua,0.00230192,True,Boston_bull
1295,"Meet Vinnie. He's having fun while being safe. Well not a lot of fun, but definitely safe, and that's important 8/10 https://t.co/vZYtynZZlH",8.0,10.0,Vinnie,,,,,,2015,12,15,02:02:01,312,1310,https://pbs.twimg.com/media/CWO0m8tUwAAB901.jpg,1,seat_belt,0.790028,False,Boston_bull,0.1963069999999999,True,French_bulldog,0.0124289,True,Boston_bull
1296,This pupper is very passionate about Christmas. Wanted to give the tree a hug. So cute. 8/10 https://t.co/NsGyECJuq7,8.0,10.0,None,,,pupper,,pupper,2015,12,15,01:32:24,1254,2807,https://pbs.twimg.com/media/CWOt07EUsAAnOYW.jpg,1,feather_boa,0.424106,False,Yorkshire_terrier,0.0731443,True,Shetland_sheepdog,0.0575976,True,Yorkshire_terrier
1297,ITSOFLUFFAYYYYY 12/10 https://t.co/bfw13CnuuZ,12.0,10.0,None,,,,,,2015,12,14,22:46:41,621,2025,https://pbs.twimg.com/media/CWOH4s9U8AEtkmQ.jpg,1,chow,0.2652739999999999,True,ice_bear,0.167614,False,fur_coat,0.117506,False,chow
1298,Say hello to Griffin. He's upset because his costume for Halloween didn't arrive until today. 9/10 cheer up pup https://t.co/eoBCjSFajX,9.0,10.0,Griffin,,,,,,2015,12,14,20:17:59,602,1641,https://pbs.twimg.com/media/CWNl3S9WcAARN34.jpg,1,pug,0.985387,True,Norwegian_elkhound,0.0044169,True,French_bulldog,0.00389287,True,pug
1299,Three generations of pupper. 11/10 for all https://t.co/tAmQYvzrau,11.0,10.0,None,,,pupper,,pupper,2015,12,14,18:35:43,5224,12616,https://pbs.twimg.com/media/CWNOdIpWoAAWid2.jpg,1,golden_retriever,0.7903859999999999,True,borzoi,0.0228851,True,dingo,0.0153434,False,golden_retriever
1300,Hope your Monday isn't too awful. Here's two baseball puppers. 11/10 for each https://t.co/dB0H9hdZai,11.0,10.0,None,,,,,,2015,12,14,16:34:00,748,1863,https://pbs.twimg.com/media/CWMyl9EWUAAnZJ0.jpg,2,Maltese_dog,0.579472,True,toy_poodle,0.133446,True,Shih-Tzu,0.0943966,True,Maltese_dog
1301,"Meet Duke. He's an Urban Parmesan. They know he's scared of the green rubber dog. ""Why u do dis?"" thinks Duke. 10/10 https://t.co/3bim9U5Idr",10.0,10.0,Duke,,,,,,2015,12,14,15:57:56,385,1526,https://pbs.twimg.com/media/CWMqV7WUYAEEClG.jpg,1,golden_retriever,0.583875,True,cocker_spaniel,0.203671,True,Labrador_retriever,0.0361217,True,golden_retriever
1302,All this pupper wanted to do was go skiing. No one told him about the El NiÃ±o. Poor pupper. 10/10 maybe next year https://t.co/fTgbq1UBR9,10.0,10.0,None,,,pupper,,pupper,2015,12,14,04:52:55,609,2243,https://pbs.twimg.com/media/CWKSIfUUYAAiOBO.jpg,1,teddy,0.0982826,False,toy_poodle,0.0980293,True,shopping_basket,0.0778521,False,toy_poodle
1303,Say hello to Winston. He has no respect for the system. Much rebellion. I think that's a palm tree... nice. 8/10 https://t.co/dOLQddhXLZ,8.0,10.0,Winston,,,,,,2015,12,14,03:08:46,331,1335,https://pbs.twimg.com/media/CWJ6Sc-WwAAlpI6.jpg,1,French_bulldog,0.961996,True,Chihuahua,0.021793,True,Boston_bull,0.00691629,True,French_bulldog
1304,This is Kenneth. He's stuck in a bubble. 10/10 hang in there Kenneth https://t.co/uQt37xlYMJ,10.0,10.0,Kenneth,,,,,,2015,12,14,01:58:31,31989,67100,https://pbs.twimg.com/media/CWJqN9iWwAAg86R.jpg,1,bubble,0.997556,False,leafhopper,0.000158961,False,whippet,0.000132464,True,whippet
