,text,rating_numerator,rating_denominator,name,doggo,floofer,pupper,puppo,stage,year,month,day,time,retweet_count,favorite_count,jpg_url,img_num,p1,p1_conf,p1_dog,p2,p2_conf,p2_dog,p3,p3_conf,p3_dog,dog_type
752,This is Rory. He's extremely impatient. 11/10 settle down pupper https://t.co/e3tfXJLi40,11.0,10.0,Rory,,,pupper,,pupper,2016,5,28,01:18:00,1408,4367,https://pbs.twimg.com/media/CjgYyuvWkAAHU8g.jpg,3,cup,0.473555,False,toy_poodle,0.082606,True,consomme,0.048298,False,toy_poodle
753,We only rate dogs. Please stop sending in non-canines like this Alaskan Flop Turtle. This is very frustrating. 10/10 https://t.co/qXteK6Atxc,10.0,10.0,very,,,,,,2016,5,27,15:58:54,3115,8901,https://pbs.twimg.com/media/CjeY5DKXEAA3WkD.jpg,1,Labrador_retriever,0.399217,True,West_Highland_white_terrier,0.13771,True,cocker_spaniel,0.0620327,True,Labrador_retriever
754,Right after you graduate vs when you remember you're on your own now and can barely work a washing machine ...10/10 https://t.co/O1TLuYjsNS,10.0,10.0,None,,,,,,2016,5,27,01:47:23,3355,8652,https://pbs.twimg.com/media/CjbV-lEWgAAr6WY.jpg,2,golden_retriever,0.553901,True,Labrador_retriever,0.119475,True,bluetick,0.077475,True,golden_retriever
755,This is Maxaroni. He's curly af. Also rather fabulous. 11/10 would hug well https://t.co/A216OjIdca,11.0,10.0,Maxaroni,,,,,,2016,5,27,00:32:10,1283,3934,https://pbs.twimg.com/media/CjbExRKUoAAs089.jpg,2,cocker_spaniel,0.961643,True,toy_poodle,0.0115468999999999,True,soft-coated_wheaten_terrier,0.00490333,True,cocker_spaniel
756,*faints* 12/10 perfection in pupper form https://t.co/t6TxTwTLEK,12.0,10.0,None,,,pupper,,pupper,2016,5,26,01:47:51,1237,4397,https://pbs.twimg.com/media/CjWMezdW0AErwU3.jpg,1,Pembroke,0.4625939999999999,True,seat_belt,0.261854,False,Cardigan,0.151698,True,Pembroke
757,This is Dakota. He hasn't grow into his skin yet. 11/10 would squeeze softly https://t.co/IvFSlNXpgj,11.0,10.0,Dakota,,,,,,2016,5,26,00:54:06,2659,6776,https://pbs.twimg.com/media/CjWANBlVAAAaN-a.jpg,1,pug,0.8918709999999999,True,goose,0.0143766,False,fur_coat,0.00845143,False,pug
758,This is Kellogg. He accidentally opened the front facing camera. 8/10 get it together doggo https://t.co/MRYv7nDPyS,8.0,10.0,Kellogg,doggo,,,,doggo,2016,5,24,23:47:49,993,3675,https://pbs.twimg.com/media/CjQnclkVEAA4pnK.jpg,1,Staffordshire_bullterrier,0.523191,True,French_bulldog,0.3511039999999999,True,doormat,0.0280752999999999,False,Staffordshire_bullterrier
759,Meet Buckley. His family &amp; some neighbors came over to watch him perform but he's nervous af. 9/10 u got this pupper https://t.co/5bdCpPlno9,9.0,10.0,Buckley,,,pupper,,pupper,2016,5,24,15:55:00,1092,3428,https://pbs.twimg.com/media/CjO7OfeWgAAUQy-.jpg,1,Walker_hound,0.413535,True,beagle,0.233891,True,English_foxhound,0.164943,True,Walker_hound
760,This is Jax. He's a literal fluffball. Sneaky tongue slip. 10/10 would pet nonstop https://t.co/9MGouPwQmK,10.0,10.0,Jax,,,,,,2016,5,24,01:02:00,572,2993,https://pbs.twimg.com/media/CjLuzPvUoAAbU5k.jpg,1,Maltese_dog,0.847292,True,feather_boa,0.0593786,False,Old_English_sheepdog,0.052758,True,Maltese_dog
761,This dog is more successful than I will ever be. 13/10 absolute legend https://t.co/BPoaHySYwA,13.0,10.0,None,,,,,,2016,5,23,16:46:51,7102,13745,https://pbs.twimg.com/media/CjJ9gQ1WgAAXQtJ.jpg,4,golden_retriever,0.883991,True,chow,0.0235416,True,Labrador_retriever,0.0160559,True,golden_retriever
762,This is Livvie. Someone should tell her it's been 47 years since Woodstock. Magical eyes tho 11/10 would stare into https://t.co/qw07vhVHuO,11.0,10.0,Livvie,,,,,,2016,5,23,16:01:50,608,2742,https://pbs.twimg.com/media/CjJzMlBUoAADMLx.jpg,1,Siberian_husky,0.304902,True,Eskimo_dog,0.155147,True,malamute,0.0509424,True,Siberian_husky
763,This is Terry. The harder you hug him the farther his tongue sticks out. 10/10 magical af https://t.co/RFToQQI8fJ,10.0,10.0,Terry,,,,,,2016,5,21,01:13:53,881,3926,https://pbs.twimg.com/media/Ci8UxxcW0AYgHDh.jpg,2,beagle,0.4723239999999999,True,Walker_hound,0.121779,True,Saint_Bernard,0.11464,True,beagle
764,This is Moose. He's a Polynesian Floofer. Dapper af. 10/10 would pet diligently https://t.co/mVfqRdppTL,10.0,10.0,Moose,,floofer,,,floofer,2016,5,21,00:50:46,1141,4015,https://pbs.twimg.com/media/Ci8Pfg_UUAA2m9i.jpg,1,Lhasa,0.457356,True,Shih-Tzu,0.371282,True,Tibetan_terrier,0.048359,True,Lhasa
765,"""Ello this is dog how may I assist"" ...10/10 https://t.co/jeAENpjH7L",10.0,10.0,None,,,,,,2016,5,20,02:18:32,1065,3438,https://pbs.twimg.com/media/Ci3Z_idUkAA8RUh.jpg,1,French_bulldog,0.619382,True,computer_keyboard,0.142274,False,mouse,0.0585047,False,French_bulldog
766,This is Hermione. Her face is as old as time. Appears fluffy af tho. 11/10 pretty damn majestic https://t.co/0b41Q4DKCA,11.0,10.0,Hermione,,,,,,2016,5,20,00:51:30,1451,4605,https://pbs.twimg.com/media/Ci3GDeyUoAAKOxn.jpg,1,chow,0.931275,True,beaver,0.0288311,False,dhole,0.017379,False,chow
767,This is Ralpher. He's an East Guinean Flop Dog. Cuddly af. 12/10 https://t.co/rVOLuNRpjH,12.0,10.0,Ralpher,,,,,,2016,5,18,00:39:02,599,2671,https://pbs.twimg.com/media/CiswCQhWYAI5-QW.jpg,1,koala,0.162935,False,Staffordshire_bullterrier,0.127969,True,mongoose,0.096421,False,Staffordshire_bullterrier
768,This is Aldrick. He looks wise af. Also exceptionally fluffy. Only two legs tho (unfortunate). 11/10 would still hug https://t.co/QwiCVLPMNL,11.0,10.0,Aldrick,,,,,,2016,5,18,00:14:46,1003,3855,https://pbs.twimg.com/media/CisqdVcXEAE3iW7.jpg,1,Pomeranian,0.961902,True,Samoyed,0.0242893,True,chow,0.00577178,True,Pomeranian
769,"When your teacher agreed on 10,000 RTs and no final but after 24 hours you only have 37... 10/10 https://t.co/sVnJfWVjUp",10.0,10.0,None,,,,,,2016,5,17,14:57:41,868,4016,https://pbs.twimg.com/media/Ciqq-VFUUAANlWm.jpg,2,Staffordshire_bullterrier,0.843359,True,American_Staffordshire_terrier,0.0282903,True,miniature_pinscher,0.0167929,True,Staffordshire_bullterrier
770,This is Kyle (pronounced 'Mitch'). He strives to be the best doggo he can be. 11/10 would pat on head approvingly https://t.co/aA2GiTGvlE,11.0,10.0,Kyle,doggo,,,,doggo,2016,5,17,01:00:32,2838,8832,https://pbs.twimg.com/media/CinrX2EWkAABDYt.jpg,1,tennis_ball,0.998673,False,basset,0.000547053,True,golden_retriever,0.00035998,True,basset
771,This is Solomon. He's a Beneroo Cumberflop. 12/10 would hug passionately https://t.co/5phLAnGPTP,12.0,10.0,Solomon,,,,,,2016,5,14,00:49:30,1090,3798,https://pbs.twimg.com/media/CiYME3tVAAENz99.jpg,1,Pembroke,0.967103,True,Cardigan,0.0211264,True,Chihuahua,0.00223107,True,Pembroke
772,We only rate dogs. Pls stop sending non-canines like this Bulgarian Eyeless Porch Bear. This is unacceptable... 9/10 https://t.co/2yctWAUZ3Z,9.0,10.0,unacceptable,,,,,,2016,5,13,00:56:32,2234,6682,https://pbs.twimg.com/media/CiTEFjDXAAAqU6I.jpg,1,polecat,0.185382,False,mink,0.1052819999999999,False,Newfoundland,0.0862411,True,Newfoundland
773,This is Rooney. He can't comprehend glass. 10/10 it'll be ok pupper https://t.co/CnUl2uDBBV,10.0,10.0,Rooney,,,pupper,,pupper,2016,5,12,01:40:42,2435,5407,https://pbs.twimg.com/media/CiOEnI6WgAAmq4E.jpg,2,American_Staffordshire_terrier,0.810158,True,Labrador_retriever,0.0582049999999999,True,Weimaraner,0.0279295,True,American_Staffordshire_terrier
774,This is Crystal. She's flawless. Really wants to be a frat bro. 11/10 who does she even know here? https://t.co/WyqNFvEulG,11.0,10.0,Crystal,,,,,,2016,5,11,15:59:50,1176,3809,https://pbs.twimg.com/media/CiL_qh0W0AAu5VA.jpg,1,Eskimo_dog,0.682082,True,Siberian_husky,0.289288,True,Staffordshire_bullterrier,0.00877069,True,Eskimo_dog
775,This is Ziva. She doesn't know how her collar works. 11/10 would totally fix for her https://t.co/K7pthJXjWE,11.0,10.0,Ziva,,,,,,2016,5,11,01:44:07,1182,4180,https://pbs.twimg.com/media/CiI7zVZUoAEzGW7.jpg,1,pug,0.341663,True,Norwegian_elkhound,0.171222,True,German_shepherd,0.1246869999999999,True,pug
776,This is Stefan. He's a downright remarkable pup. 13/10 https://t.co/Ebjt6Y4fMh,13.0,10.0,Stefan,,,,,,2016,5,10,00:01:12,1390,4358,https://pbs.twimg.com/media/CiDap8fWEAAC4iW.jpg,1,kelpie,0.218408,True,Arabian_camel,0.114368,False,coyote,0.0964093,False,kelpie
777,Meet Pupcasso. You can't afford his art. 13/10 talented af https://t.co/f2VUpy4WO0,13.0,10.0,Pupcasso,,,,,,2016,5,9,00:11:16,2586,6340,https://pbs.twimg.com/media/Ch-TXpFXAAAwPGf.jpg,1,German_shepherd,0.829307,True,Doberman,0.0225,True,basenji,0.0211901,True,German_shepherd
778,"This is Puff. He started out on the streets (first pic), but don't let the new smile fool you, still tough af. 11/10 https://t.co/kiuXRXcg4B",11.0,10.0,Puff,,,,,,2016,5,7,16:34:32,917,3460,https://pbs.twimg.com/media/Ch3hOGWUYAE7w0y.jpg,2,Maltese_dog,0.95207,True,toy_poodle,0.0272705999999999,True,miniature_poodle,0.00487436,True,Maltese_dog
779,"When you're way too slow for the ""down low"" portion of a high five. 13/10 https://t.co/Cofwoy7Vpq",13.0,10.0,None,,,,,,2016,5,7,01:37:30,1911,5090,https://pbs.twimg.com/media/Ch0T71OWMAA4yIw.jpg,1,Pembroke,0.939134,True,Cardigan,0.0543356,True,Chihuahua,0.00559029,True,Pembroke
780,This is Flurpson. He can't believe it's not butter. 10/10 https://t.co/XD3ort1PsE,10.0,10.0,Flurpson,,,,,,2016,5,7,00:59:55,757,3032,https://pbs.twimg.com/media/Ch0LVPdW0AEdHgU.jpg,1,Saint_Bernard,0.48205,True,collie,0.20274,True,borzoi,0.0379758,True,Saint_Bernard
781,This is Wallace. He's a skater pup. He said see ya later pup. Can easily do a kick flip. Gnarly af. 10/10 v petable https://t.co/5i8fORVKgr,10.0,10.0,Wallace,,,,,,2016,5,6,02:24:02,2269,5383,https://pbs.twimg.com/media/ChvU_DwWMAArx5L.jpg,1,Siamese_cat,0.478278,False,Saint_Bernard,0.0942456,True,king_penguin,0.0821567,False,Saint_Bernard
782,"This is Enchilada (yes, that's her real name). She's a Low-Cruisin Plopflopple. Very rare. Only a few left. 12/10 https://t.co/SiaiTWgsfP",12.0,10.0,Enchilada,,,,,,2016,5,6,00:53:27,1075,3999,https://pbs.twimg.com/media/ChvAQuMWMAAVaKD.jpg,1,collie,0.266414,True,Great_Pyrenees,0.138546,True,keeshond,0.109014,True,collie
783,This is Raymond. He controls fountains with his tongue. 11/10 pretty damn magical https://t.co/9aMxSbOaAZ,11.0,10.0,Raymond,,,,,,2016,5,5,02:21:37,1328,4722,https://pbs.twimg.com/media/ChqK2cVWMAAE5Zj.jpg,1,Newfoundland,0.255971,True,groenendael,0.175583,True,German_shepherd,0.164135,True,Newfoundland
784,This is all I want in my life. 12/10 for super sleepy pupper https://t.co/4RlLA5ObMh,12.0,10.0,all,,,pupper,,pupper,2016,5,5,01:35:26,1872,4953,https://pbs.twimg.com/media/ChqARqmWsAEI6fB.jpg,1,handkerchief,0.302961,False,Pomeranian,0.248664,True,Shih-Tzu,0.111015,True,Pomeranian
785,This is Rueben. He has reached ultimate pupper zen state. 11/10 tranquil af https://t.co/Z167HgtnBi,11.0,10.0,Rueben,,,pupper,,pupper,2016,5,5,00:16:48,1219,4479,https://pbs.twimg.com/media/ChpuRyvVAAARMoq.jpg,1,cocker_spaniel,0.384559,True,golden_retriever,0.091661,True,sandbar,0.0817989,False,cocker_spaniel
786,This is Cilantro. She's a Fellation Gadzooks. Eyes are super magical af. 12/10 could get lost in https://t.co/yJ26LNuyj5,12.0,10.0,Cilantro,,,,,,2016,5,4,02:26:00,720,3206,https://pbs.twimg.com/media/ChlCQg-VIAQ_8g4.jpg,1,Border_collie,0.462408,True,collie,0.214556,True,Eskimo_dog,0.0356036,True,Border_collie
787,Here's a doggo struggling to cope with the winds. 13/10 https://t.co/qv3aUwaouT,13.0,10.0,None,doggo,,,,doggo,2016,5,3,23:42:26,1962,6431,https://pbs.twimg.com/media/Chkc1BQUoAAa96R.jpg,2,Great_Pyrenees,0.457164,True,kuvasz,0.39171,True,Labrador_retriever,0.0945226,True,Great_Pyrenees
788,This pupper had to undergo emergency haircut surgery so he could hear again. 10/10 miraculous af https://t.co/fUyDIFkBwx,10.0,10.0,None,,,pupper,,pupper,2016,5,3,15:46:33,1379,4900,https://pbs.twimg.com/media/Chiv6BAW4AAiQvH.jpg,2,Pomeranian,0.958834,True,Chihuahua,0.0240992,True,chow,0.00394105,True,Pomeranian
789,This pupper was about to explain where that dirt came from but then decided against it. 11/10 https://t.co/SbaelU6zRs,11.0,10.0,None,,,pupper,,pupper,2016,5,3,01:50:44,834,3623,https://pbs.twimg.com/media/Chfwmd9U4AQTf1b.jpg,2,toy_poodle,0.827469,True,miniature_poodle,0.16076,True,Tibetan_terrier,0.00173075,True,toy_poodle
790,I swear to god if we get sent another Blue Madagascan Peacock we'll deactivate. We ðŸ‘ Only ðŸ‘ Rate ðŸ‘ Dogs... 9/10 https://t.co/bbta2Q4URK,9.0,10.0,None,,,,,,2016,5,2,23:59:09,920,3324,https://pbs.twimg.com/media/ChfXDrGUkAEAtF-.jpg,1,bonnet,0.14644,False,sock,0.083091,False,Chihuahua,0.0705542,True,Chihuahua
791,This is Karll. He just wants to go kayaking. 10/10 please someone take Karll kayaking already https://t.co/vXLkvyNQHp,10.0,10.0,Karll,,,,,,2016,5,2,16:38:15,1540,4209,https://pbs.twimg.com/media/ChdyJvdWwAA5HGd.jpg,2,flat-coated_retriever,0.656463,True,Great_Dane,0.0847658,True,Labrador_retriever,0.0589085,True,flat-coated_retriever
792,This is Sprout. He's just precious af. 12/10 I'd do anything for Sprout https://t.co/DxlX1yTVYY,12.0,10.0,Sprout,,,,,,2016,5,2,00:43:25,2738,7496,https://pbs.twimg.com/media/ChaXmuAXEAE66KP.jpg,2,teddy,0.821615,False,toy_poodle,0.083749,True,Lakeland_terrier,0.033318,True,toy_poodle
793,This is Blitz. He's a new dad struggling to cope mentally with the pressures of being a father. Sick shades 10/10 https://t.co/2AVcJ2BZsy,10.0,10.0,Blitz,,,,,,2016,5,1,21:32:40,1677,4195,https://pbs.twimg.com/media/ChZr8SdWIAAVQKt.jpg,1,soft-coated_wheaten_terrier,0.5159189999999999,True,Irish_terrier,0.162655,True,Chesapeake_Bay_retriever,0.125182,True,soft-coated_wheaten_terrier
794,This is Bloop. He's a Phoenician Winnebago. Tongue is just wow. That box is all he has (tragic). 12/10 would caress https://t.co/DWNrPPXgHA,12.0,10.0,Bloop,,,,,,2016,5,1,17:38:46,1124,3882,https://pbs.twimg.com/media/ChY2aHyWMAAbNQE.jpg,1,miniature_pinscher,0.2553269999999999,True,Border_terrier,0.181279,True,Labrador_retriever,0.125185,True,miniature_pinscher
795,I'm getting super heckin frustrated with you all sending in non canines like this ostrich. We only rate dogs... 9/10 https://t.co/Rgbni2Ns8z,9.0,10.0,None,,,,,,2016,4,30,01:41:23,1302,4811,https://pbs.twimg.com/media/ChQRsYaW0AETD7z.jpg,1,standard_poodle,0.261112,True,cocker_spaniel,0.0947852,True,bucket,0.0699463999999999,False,standard_poodle
796,Say hello to Lillie. She's a Rutabagan Floofem. Poor pupper ate and then passed out. 11/10 relatable af https://t.co/uIdGqug9rw,11.0,10.0,Lillie,,,pupper,,pupper,2016,4,28,20:40:11,1527,4537,https://pbs.twimg.com/media/ChKDKmIWIAIJP_e.jpg,1,chow,0.335761,True,Samoyed,0.167173,True,kuvasz,0.145715,True,chow
797,This is Lola. She's a Butternut Splishnsplash. They are known to be ferocious af. 12/10 would absolutely still pet https://t.co/adQt5a6TZU,12.0,10.0,Lola,,,,,,2016,4,28,16:52:08,2009,5646,https://pbs.twimg.com/media/ChJO9YaWYAEL0zC.jpg,1,boxer,0.599076,True,bull_mastiff,0.177318,True,French_bulldog,0.141461,True,boxer
798,This is Fred-Rick. He dabbles in parkour. The elevation gives him power. 12/10 hopefully visiting a mailbox near you https://t.co/qFqLtudIiD,12.0,10.0,Fred,,,,,,2016,4,26,15:29:30,1462,4040,https://pbs.twimg.com/media/Cg-o3w0WgAANXdv.jpg,1,golden_retriever,0.67575,True,Great_Pyrenees,0.0951679,True,cocker_spaniel,0.0760429,True,golden_retriever
799,Nothin better than a doggo and a sunset. 11/10 https://t.co/JlFqOhrHEs,11.0,10.0,None,doggo,,,,doggo,2016,4,26,01:26:53,725,2593,https://pbs.twimg.com/media/Cg7n_-OU8AA5RR1.jpg,2,German_short-haired_pointer,0.835491,True,bluetick,0.058788,True,English_setter,0.0372083,True,German_short-haired_pointer
800,This is Ashleigh. She's having Coachella withdrawals. Didn't even go tho. 10/10 stay strong pupper https://t.co/nRUaKWnJfH,10.0,10.0,Ashleigh,,,pupper,,pupper,2016,4,25,01:12:38,1847,5800,https://pbs.twimg.com/media/Cg2bKLAWwAA0WEm.jpg,1,golden_retriever,0.240695,True,cocker_spaniel,0.202444,True,feather_boa,0.159348,False,golden_retriever
801,This is Kreggory. He just took a look at his student debt. 10/10 can't even comprehend it https://t.co/XTsZTgilnT,10.0,10.0,Kreggory,,,,,,2016,4,24,01:38:33,1984,4738,https://pbs.twimg.com/media/CgxXf1TWYAEjY61.jpg,1,Border_collie,0.581835,True,collie,0.344588,True,Shetland_sheepdog,0.0435842,True,Border_collie
802,"This is Sarge. Not even he knows what his tongue is doing, but it's pretty damn spectacular. 10/10 https://t.co/pIQEdbBxdL",10.0,10.0,Sarge,,,,,,2016,4,24,01:24:35,620,2901,https://pbs.twimg.com/media/CgxUTS_XEAAC0pv.jpg,1,boxer,0.8262719999999999,True,bull_mastiff,0.158595,True,Great_Dane,0.0118586,True,boxer
803,This is Luther. He saw a ghost. Spooked af. 11/10 hang in there pupper https://t.co/EdKG43VvEl,11.0,10.0,Luther,,,pupper,,pupper,2016,4,23,22:38:43,1790,4561,https://pbs.twimg.com/media/CgwuWCeW4AAsgbD.jpg,3,Siamese_cat,0.950526,False,pug,0.0188769,True,quilt,0.0076276,False,pug
804,This is Sugar. She's a Bolivian Superfloof. Spherical af. 12/10 would never let go of https://t.co/AhMfUu6Onm,12.0,10.0,Sugar,,,,,,2016,4,23,16:34:28,1374,4236,https://pbs.twimg.com/media/Cgva-QqUUAA7Hv9.jpg,1,Samoyed,0.991772,True,Pomeranian,0.00362638,True,chow,0.00223183,True,Samoyed
805,This is Reginald. He starts screaming at random. 12/10 cuddly af https://t.co/YgNuDQbv89,12.0,10.0,Reginald,,,,,,2016,4,23,01:41:59,3347,8435,https://pbs.twimg.com/media/CgsOszGW0AAruKp.jpg,2,teddy,0.263256,False,chow,0.0890102,True,Irish_terrier,0.0653057,True,chow
806,This is Ivar. She is a badass Viking warrior. Will sack your village. 10/10 savage af https://t.co/Dz6MiVssVU,10.0,10.0,Ivar,,,,,,2016,4,23,00:41:42,1011,3291,https://pbs.twimg.com/media/CgsA5eFWgAAu0qn.jpg,1,golden_retriever,0.83939,True,Labrador_retriever,0.0657058,True,hand_blower,0.012941,False,golden_retriever
807,This is Jangle. She's addicted to broccoli. It's the only thing she cares about. Tragic af. 8/10 get help pup https://t.co/8dNWp1cSEa,8.0,10.0,Jangle,,,,,,2016,4,21,16:00:57,2110,5761,https://pbs.twimg.com/media/CglAHjAUgAAfxcq.jpg,1,tennis_ball,0.176495,False,badger,0.0599052,False,Norwegian_elkhound,0.0568505,True,Norwegian_elkhound
808,Happy 4/20 from the squad! 13/10 for all https://t.co/eV1diwds8a,4.0,20.0,None,,,,,,2016,4,21,02:25:47,1764,4493,https://pbs.twimg.com/media/CgiFjIpWgAA4wVp.jpg,1,Great_Dane,0.2467619999999999,True,Greater_Swiss_Mountain_dog,0.126131,True,Weimaraner,0.0852969,True,Great_Dane
809,Meet Schnitzel. He's a Tropicana Floofboop. Getting too big for his favorite basket. 12/10 just so damn fluffy https://t.co/qjd0UJKYUY,12.0,10.0,Schnitzel,,,,,,2016,4,20,02:30:23,1831,5393,https://pbs.twimg.com/media/Cgc9AjMVIAERdUA.jpg,1,Labrador_retriever,0.5309149999999999,True,golden_retriever,0.28823,True,chow,0.0448536999999999,True,Labrador_retriever
810,This is Panda. He's happy af. 11/10 https://t.co/IOAk9i4UvE,11.0,10.0,Panda,,,,,,2016,4,17,00:58:53,2124,5086,https://pbs.twimg.com/media/CgNLS1PW8AAxWSN.jpg,3,Pomeranian,0.99775,True,Chihuahua,0.001248,True,Pekinese,0.000775002,True,Pomeranian
811,This is Oliver. Bath time is upon him. His fear of the wetness postpones his ultimate pupper destiny. 11/10 https://t.co/AFzzKqR4tT,11.0,10.0,Oliver,,,pupper,,pupper,2016,4,15,15:44:11,686,2748,https://pbs.twimg.com/media/CgGCvxAUkAAx55r.jpg,1,Samoyed,0.950053,True,washbasin,0.00632139,False,tub,0.00624335,False,Samoyed
812,This is Archie. He hears everything you say. Doesn't matter where you are. 12/10 https://t.co/0l4I8famYp,12.0,10.0,Archie,,,,,,2016,4,15,01:26:47,866,3400,https://pbs.twimg.com/media/CgC-gMCWcAAawUE.jpg,1,Chihuahua,0.8964219999999999,True,dingo,0.0279294,False,kelpie,0.0179158,True,Chihuahua
813,This is Berkeley. He's in a predicament. 10/10 someone help him https://t.co/XSEXdQupej,10.0,10.0,Berkeley,,,,,,2016,4,15,00:46:48,760,2702,https://pbs.twimg.com/media/CgC1WqMW4AI1_N0.jpg,1,Newfoundland,0.4899699999999999,True,groenendael,0.174497,True,giant_schnauzer,0.0790666999999999,True,Newfoundland
814,Garden's coming in nice this year. 10/10 https://t.co/5Lra3e4rrw,10.0,10.0,None,,,,,,2016,4,14,00:55:25,1681,4503,https://pbs.twimg.com/media/Cf9tuHUWsAAHSrV.jpg,1,Rottweiler,0.990312,True,black-and-tan_coonhound,0.00249478,True,American_black_bear,0.00173312,False,Rottweiler
815,This is RalphÃ©. He patrols the lake. Looking for babes. 11/10 https://t.co/Pb6iMmo0wk,11.0,10.0,RalphÃ©,,,,,,2016,4,13,23:15:21,2840,6974,https://pbs.twimg.com/media/Cf9W1J-UMAErahM.jpg,1,Pembroke,0.873977,True,Cardigan,0.0433385,True,Eskimo_dog,0.0191970999999999,True,Pembroke
816,This is Charleson. He lost his plunger. Looked everywhere. Can't find it. So sad. 9/10 would comfort https://t.co/pRHX8yn9Yu,9.0,10.0,Charleson,,,,,,2016,4,13,01:22:10,1268,4229,https://pbs.twimg.com/media/Cf4qRcmWEAA9V4h.jpg,1,Mexican_hairless,0.451852,True,redbone,0.254884,True,Italian_greyhound,0.0948181,True,Mexican_hairless
817,This is Neptune. He's a Snowy Swiss Mountain Floofapolis. Cheeky wink. Tongue nifty af. 11/10 would pet so firmly https://t.co/SoZq2Xoopv,11.0,10.0,Neptune,,,,,,2016,4,13,00:17:25,2253,5332,https://pbs.twimg.com/media/Cf4bcm8XEAAX4xV.jpg,1,Samoyed,0.954517,True,Eskimo_dog,0.0291296,True,white_wolf,0.00446203,False,Samoyed
818,This doggo was initially thrilled when she saw the happy cartoon pup but quickly realized she'd been deceived. 10/10 https://t.co/mvnBGaWULV,10.0,10.0,None,doggo,,,,doggo,2016,4,12,20:50:42,1979,5281,https://pbs.twimg.com/media/Cf3sH62VAAA-LiP.jpg,2,golden_retriever,0.605304,True,cocker_spaniel,0.130948,True,Labrador_retriever,0.0946916,True,golden_retriever
819,This is Harnold. He accidentally opened the front facing camera. 10/10 get it together Harnold https://t.co/S6JHaSMtln,10.0,10.0,Harnold,,,,,,2016,4,11,15:43:12,2192,5515,https://pbs.twimg.com/media/CfxcKU6W8AE-wEx.jpg,1,malamute,0.873233,True,Siberian_husky,0.0764353999999999,True,Eskimo_dog,0.035745,True,malamute
820,Meet Sid &amp; Murphy. Murphy floats alongside Sid and whispers motivational quotes in his ear. Magical af. Both 11/10 https://t.co/7mmjyearQW,11.0,10.0,Sid,,,,,,2016,4,11,03:33:34,827,3022,https://pbs.twimg.com/media/Cfu1KSRXEAACC5X.jpg,1,swing,0.171486,False,soft-coated_wheaten_terrier,0.0509709999999999,True,Tibetan_terrier,0.0477594,True,soft-coated_wheaten_terrier
821,Say hello to Lucy and Sophie. They think they're the same size. Both 10/10 would snug at same time https://t.co/HW50zkcf2R,10.0,10.0,Lucy,,,,,,2016,4,11,01:41:07,1403,4822,https://pbs.twimg.com/media/Cfuba6NW4AIeMHk.jpg,1,golden_retriever,0.765778,True,borzoi,0.0711481,True,Leonberg,0.0703705,True,golden_retriever
822,This is Pippa. She managed to start the car but is waiting for you to buckle up before driving. Responsible af 11/10 https://t.co/htrlmC7saz,11.0,10.0,Pippa,,,,,,2016,4,11,01:13:34,1078,3711,https://pbs.twimg.com/media/CfuVGl3WEAEKb16.jpg,1,Dandie_Dinmont,0.224415,True,miniature_poodle,0.204882,True,Norfolk_terrier,0.0906328999999999,True,Dandie_Dinmont
823,This is Sadie. She is prepared for battle. 10/10 https://t.co/JRckDkZVRT,10.0,10.0,Sadie,,,,,,2016,4,10,01:20:33,1231,3818,https://pbs.twimg.com/media/CfpNGTHUIAAA8XC.jpg,1,golden_retriever,0.140394,True,Saint_Bernard,0.118769,True,Labrador_retriever,0.0754917,True,golden_retriever
824,This is Otis. Everybody look at Otis. 12/10 would probably faint while petting https://t.co/I9qoe1uEih,12.0,10.0,Otis,,,,,,2016,4,9,23:10:47,1973,5720,https://pbs.twimg.com/media/CfovbK4WIAAkTn3.jpg,1,Pembroke,0.7663270000000001,True,Cardigan,0.222126,True,toilet_tissue,0.00675723,False,Pembroke
825,We normally don't rate marshmallows but this one appears to be flawlessly toasted so I'll make an exception. 10/10 https://t.co/D9jbbmPmos,10.0,10.0,None,,,,,,2016,4,9,02:47:55,9126,20697,https://pbs.twimg.com/media/CfkXiX6W4AAmICF.jpg,1,Pomeranian,0.993718,True,Pekinese,0.00361083,True,Persian_cat,0.000524823,False,Pomeranian
826,This is Carper. He's a Tortellini Angiosperm. In desperate need of a petting. 11/10 would hug softly https://t.co/lK9YDkRzPj,11.0,10.0,Carper,,,,,,2016,4,9,01:35:37,542,2669,https://pbs.twimg.com/media/CfkG_PMWsAAH0MZ.jpg,1,Labrador_retriever,0.58458,True,German_short-haired_pointer,0.340657,True,Chesapeake_Bay_retriever,0.0319751,True,Labrador_retriever
827,Get you a pup that can do both. 10/10 https://t.co/zSbyvm62xZ,10.0,10.0,None,,,,,,2016,4,8,20:46:50,1137,2730,https://pbs.twimg.com/media/CfjE5FRXEAErFWR.jpg,2,Maltese_dog,0.632289,True,West_Highland_white_terrier,0.187055,True,cairn,0.0444129,True,Maltese_dog
828,Meet Bowie. He's listening for underground squirrels. Smart af. Left eye is considerably magical. 9/10 would so pet https://t.co/JyNmyjy3fe,9.0,10.0,Bowie,,,,,,2016,4,8,15:26:28,602,2846,https://pbs.twimg.com/media/Cfh7j6CWQAAndTd.jpg,1,badger,0.356946,False,Boston_bull,0.252781,True,kelpie,0.1134329999999999,True,Boston_bull
829,This is Alexanderson. He's got a weird ass birth mark. Dreadful at fetch. Won't eat kibble. 3/10 wtf @Target https://t.co/FmxOpf2Sgl,3.0,10.0,Alexanderson,,,,,,2016,4,8,01:19:36,565,2115,https://pbs.twimg.com/media/Cfe5tLWXEAIaoFO.jpg,1,Chihuahua,0.354488,True,carton,0.159672,False,Siberian_husky,0.0574983,True,Chihuahua
830,This is Suki. She was born with a blurry tail (unfortunate). Next level tongue tho. 11/10 nifty hardwood https://t.co/05S8oYztgb,11.0,10.0,Suki,,,,,,2016,4,8,00:30:51,1127,4217,https://pbs.twimg.com/media/CfeukpmW4AEGjOE.jpg,1,malamute,0.370152,True,Siberian_husky,0.356398,True,Eskimo_dog,0.271042,True,malamute
831,This is Barclay. His father was a banana. 11/10 appeeling af https://t.co/ucOEfr2rjV,11.0,10.0,Barclay,,,,,,2016,4,6,22:29:56,670,2660,https://pbs.twimg.com/media/CfZJTphWAAAl5Ys.jpg,1,Brittany_spaniel,0.922876,True,English_springer,0.0701135,True,bath_towel,0.00256079,False,Brittany_spaniel
832,People please. This is a Deadly Mediterranean Plop T-Rex. We only rate dogs. Only send in dogs. Thanks you... 11/10 https://t.co/2ATDsgHD4n,11.0,10.0,a,,,,,,2016,4,6,02:21:30,2069,6281,https://pbs.twimg.com/media/CfU0t75W4AAUo9V.jpg,1,golden_retriever,0.779356,True,Labrador_retriever,0.0525114,True,kuvasz,0.0498105,True,golden_retriever
