,text,rating_numerator,rating_denominator,name,doggo,floofer,pupper,puppo,stage,year,month,day,time,retweet_count,favorite_count,jpg_url,img_num,p1,p1_conf,p1_dog,p2,p2_conf,p2_dog,p3,p3_conf,p3_dog,dog_type
365,RT @dog_rates: This is Maximus. His face is stuck like that. Tragic really. Great tongue tho. 12/10 would pet firmly https://t.co/xIfrsMNLBR,12.0,10.0,Maximus,,,,,,2016,12,16,17:14:20,5711,0,https://pbs.twimg.com/media/CwS4aqZXUAAe3IO.jpg,1,Labrador_retriever,0.8616510000000001,True,golden_retriever,0.0444618,True,Staffordshire_bullterrier,0.0164967,True,Labrador_retriever
366,"I call this one ""A Blep by the Sea"" 12/10 https://t.co/EMdnCugNbo",12.0,10.0,None,,,,,,2016,12,15,17:23:04,1696,7727,https://pbs.twimg.com/media/Czu9RiwVEAA_Okk.jpg,1,Greater_Swiss_Mountain_dog,0.375415,True,Cardigan,0.134317,True,English_springer,0.0736971,True,Greater_Swiss_Mountain_dog
367,This is Kyro. He's a Stratocumulus Flop. Tongue ejects at random. Serious h*ckin condition. Still 12/10 would pet passionately https://t.co/wHu15q2Q6p,12.0,10.0,Kyro,,,,,,2016,12,15,02:14:29,6554,22246,https://pbs.twimg.com/media/CzrtWDbWEAAmIhy.jpg,1,Pomeranian,0.8195110000000001,True,Samoyed,0.141241,True,Pembroke,0.0134552,True,Pomeranian
368,"This is Wallace. You said you brushed your teeth but he checked your toothbrush and it was bone dry. 11/10 not pupset, just disappointed https://t.co/nadm8yWZ4h",11.0,10.0,Wallace,,,,,,2016,12,14,17:16:53,4046,14685,https://pbs.twimg.com/media/CzpyM41UoAE1b2w.jpg,1,vizsla,0.911412,True,bloodhound,0.0171339,True,Labrador_retriever,0.011761,True,vizsla
369,This is Ito. He'll be your uber driver tonight. Currently adjusting the mirrors. 13/10 incredibly h*ckin responsible https://t.co/Zrrcw29o13,13.0,10.0,Ito,,,,,,2016,12,14,00:57:20,3536,11271,https://pbs.twimg.com/media/CzmSFlKUAAAQOjP.jpg,1,Rottweiler,0.36953,True,miniature_pinscher,0.194867,True,kelpie,0.160104,True,Rottweiler
370,Here's a pupper in a onesie. Quite pupset about it. Currently plotting revenge. 12/10 would rescue https://t.co/xQfrbNK3HD,12.0,10.0,None,,,pupper,,pupper,2016,12,13,18:01:07,2509,8784,https://pbs.twimg.com/media/Czky0v9VIAEXRkd.jpg,1,seat_belt,0.779137,False,toy_poodle,0.0369271,True,golden_retriever,0.0169724999999999,True,toy_poodle
371,This is Koda. He dug a hole and then sat in it because why not. Unamused by the bath that followed. 12/10 https://t.co/SQhyqrr8px,12.0,10.0,Koda,,,,,,2016,12,13,02:39:32,3007,12595,https://pbs.twimg.com/media/Czhf4XtVQAAIqpd.jpg,2,Airedale,0.454239,True,cocker_spaniel,0.219323,True,Irish_terrier,0.093193,True,Airedale
372,RT @dog_rates: This is Milo. I would do terrible things for Milo. 13/10 https://t.co/R6wJyC2Tey,13.0,10.0,Milo,,,,,,2016,12,12,02:21:26,6961,0,https://pbs.twimg.com/media/Cx5R8wPVEAALa9r.jpg,1,cocker_spaniel,0.74022,True,Dandie_Dinmont,0.0616044999999999,True,English_setter,0.0413314,True,cocker_spaniel
373,Here we have Burke (pupper) and Dexter (doggo). Pupper wants to be exactly like doggo. Both 12/10 would pet at same time https://t.co/ANBpEYHaho,12.0,10.0,None,doggo,,pupper,,"doggo,pupper",2016,12,12,00:29:28,2525,9701,https://pbs.twimg.com/media/Czb4iFRXgAIUMiN.jpg,1,golden_retriever,0.426183,True,Labrador_retriever,0.257447,True,Great_Pyrenees,0.1264819999999999,True,golden_retriever
374,This is Cooper. He likes to stick his tongue out at you and then laugh about it. 12/10 quite the jokester https://t.co/O9iGgvfuzl,12.0,10.0,Cooper,,,,,,2016,12,11,17:31:39,4098,14015,https://pbs.twimg.com/media/CzaY5UdUoAAC91S.jpg,1,Labrador_retriever,0.730959,True,Staffordshire_bullterrier,0.130726,True,American_Staffordshire_terrier,0.0288526,True,Labrador_retriever
375,This is Ollie Vue. He was a 3 legged pupper on a mission to overcome everything. This is very hard to write. 14/10 we will miss you Ollie https://t.co/qTRY2qX9y4,14.0,10.0,Ollie,,,pupper,,pupper,2016,12,10,16:22:02,4288,16236,https://pbs.twimg.com/media/CzU_YVGUUAA3Xsd.jpg,3,golden_retriever,0.873233,True,cocker_spaniel,0.0336933,True,chow,0.0204084,True,golden_retriever
376,RT @dog_rates: This is Cali. She arrived preassembled. Convenient af. 12/10 appears to be rather h*ckin pettable https://t.co/vOBV1ZqVcX,12.0,10.0,Cali,,,,,,2016,12,9,03:08:45,8521,0,https://pbs.twimg.com/media/Ct2qO5PXEAE6eB0.jpg,1,seat_belt,0.474292,False,golden_retriever,0.171393,True,Labrador_retriever,0.110592,True,golden_retriever
377,This is Lennon. He's a Boopershnoop Pupperdoop. Quite rare. Exceptionally pettable. 12/10 would definitely boop that shnoop https://t.co/fhgP6vSfhX,12.0,10.0,Lennon,,,,,,2016,12,8,23:53:08,4418,14514,https://pbs.twimg.com/media/CzMTcZoXUAEKqEt.jpg,1,golden_retriever,0.610807,True,Irish_setter,0.213642,True,Welsh_springer_spaniel,0.0318866,True,golden_retriever
378,This is Waffles. He's concerned that the dandruff shampoo he just bought is faulty. 11/10 tragic af https://t.co/BCB87qUU0h,11.0,10.0,Waffles,,,,,,2016,12,7,16:53:43,2752,11363,https://pbs.twimg.com/media/CzFp3FNW8AAfvV8.jpg,1,vizsla,0.938617,True,Brittany_spaniel,0.0367389,True,Chesapeake_Bay_retriever,0.00397149,True,vizsla
379,RT @dog_rates: This is Dave. He's currently in a predicament. Doesn't seem to mind tho. 12/10 someone assist Dave https://t.co/nfprKAXqwu,12.0,10.0,Dave,,,,,,2016,12,6,21:04:11,13616,0,https://pbs.twimg.com/media/Ct72q9jWcAAhlnw.jpg,2,Cardigan,0.593858,True,Shetland_sheepdog,0.1306109999999999,True,Pembroke,0.100842,True,Cardigan
380,We only rate dogs. Please stop sending in non-canines like this Freudian Poof Lion. This is incredibly frustrating... 11/10 https://t.co/IZidSrBvhi,11.0,10.0,incredibly,,,,,,2016,12,6,19:29:28,1388,7145,https://pbs.twimg.com/media/CzBD7MWVIAA5ptx.jpg,1,chow,0.835102,True,Pomeranian,0.0407829,True,Eskimo_dog,0.0212745,True,chow
381,"RT @dog_rates: This is Penny. She fought a bee and the bee won. 10/10 you're fine Penny, everything's fine https://t.co/zrMVdfFej6",10.0,10.0,Penny,,,,,,2016,12,6,02:15:59,6238,0,https://pbs.twimg.com/media/CtzKC7zXEAALfSo.jpg,1,Irish_setter,0.574557,True,golden_retriever,0.339251,True,seat_belt,0.0461082,False,Irish_setter
382,This is Major. He put on a tie for his first real walk. Only a little crooked. Can also drool upwards. H*ckin talented. 12/10 https://t.co/Zcwr8LgoO8,12.0,10.0,Major,,,,,,2016,12,6,00:32:26,2209,9178,https://pbs.twimg.com/media/Cy8_qt0UUAAHuuN.jpg,1,Norwegian_elkhound,0.657967,True,keeshond,0.319136,True,Leonberg,0.00794674,True,Norwegian_elkhound
383,This is Duke. He is not a fan of the pupporazzi. 12/10 https://t.co/SgpBVYIL18,12.0,10.0,Duke,,,,,,2016,12,5,17:31:15,2132,7335,https://pbs.twimg.com/ext_tw_video_thumb/805826823359631360/pu/img/yr_fF0TZCR-B70p2.jpg,1,Siberian_husky,0.248926,True,American_Staffordshire_terrier,0.0983133,True,Eskimo_dog,0.0801885,True,Siberian_husky
384,This is Zeke the Wonder Dog. He never let that poor man keep his frisbees. One of the Spartans all time greatest receivers. 13/10 RIP Zeke https://t.co/zacX7S6GyJ,13.0,10.0,Zeke,,,,,,2016,12,4,21:14:20,1905,6368,https://pbs.twimg.com/media/Cy3IvdZXgAUoEaj.jpg,1,malinois,0.643147,True,German_shepherd,0.186642,True,Border_terrier,0.109345,True,malinois
385,This is Shooter. He's doing quite the snowy zoom. 12/10 https://t.co/lHy4Xbyhd9,12.0,10.0,Shooter,,,,,,2016,12,4,00:30:29,1972,8680,https://pbs.twimg.com/media/CyysDQlVIAAYgrl.jpg,1,Pembroke,0.244705,True,Rhodesian_ridgeback,0.1804609999999999,True,Cardigan,0.0946636999999999,True,Pembroke
386,This is Django. He accidentally opened the front facing camera. Did him quite the frighten. 12/10 https://t.co/kQVQoOW9NZ,12.0,10.0,Django,,,,,,2016,12,2,17:27:25,4480,15326,https://pbs.twimg.com/media/CysBn-lWIAAoRx1.jpg,1,Tibetan_mastiff,0.91579,True,German_shepherd,0.0624797,True,Leonberg,0.00829749,True,Tibetan_mastiff
387,RT @dog_rates: This is Rusty. He's going D1 for sure. Insane vertical. 13/10 would draft https://t.co/AsykOwMrXQ,13.0,10.0,Rusty,,,,,,2016,12,1,19:56:00,3712,0,https://pbs.twimg.com/media/CuRDF-XWcAIZSer.jpg,1,chow,0.0903414,True,binoculars,0.0834988,False,Irish_setter,0.0774556,True,chow
388,This is Diogi. He fell in the pool as soon as he was brought home. Clumsy puppo. 12/10 would pet until dry https://t.co/ZxeRjMKaWt,12.0,10.0,Diogi,,,,puppo,puppo,2016,11,30,01:31:12,3220,11203,https://pbs.twimg.com/media/CyeTku-XcAALkBd.jpg,2,miniature_pinscher,0.817066,True,redbone,0.0597065,True,Irish_terrier,0.0341952,True,miniature_pinscher
389,RT @dog_rates: I present to you... Dog Jesus. 13/10 (he could be sitting on a rock but I doubt it) https://t.co/fR1P3g5I6k,13.0,10.0,None,,,,,,2016,11,29,20:08:52,8689,0,https://pbs.twimg.com/media/CZhn-QAWwAASQan.jpg,1,Lakeland_terrier,0.530104,True,Irish_terrier,0.197314,True,Airedale,0.0825146,True,Lakeland_terrier
390,Pupper hath acquire enemy. 13/10 https://t.co/ns9qoElfsX,13.0,10.0,None,,,pupper,,pupper,2016,11,29,16:33:36,4828,12270,https://pbs.twimg.com/ext_tw_video_thumb/803638023904559104/pu/img/vxm0Htm5iIV7EOAQ.jpg,1,Labrador_retriever,0.372776,True,golden_retriever,0.3436659999999999,True,Great_Pyrenees,0.0672423,True,Labrador_retriever
391,This is Winston. His selfie game is legendary. Will steal your girl with a single snap. 11/10 handsome as h*ck https://t.co/jxQhxoPsgL,11.0,10.0,Winston,,,,,,2016,11,28,16:37:19,2887,11207,https://pbs.twimg.com/media/CyXPzXRWgAAvd1j.jpg,1,Pembroke,0.457086,True,chow,0.307801,True,golden_retriever,0.0499881999999999,True,Pembroke
392,This is Marley. She's having a ruff day. Pretty pupset. 12/10 would assist https://t.co/yLm7hQ6UXh,12.0,10.0,Marley,,,,,,2016,11,27,19:09:28,2336,10085,https://pbs.twimg.com/media/CySpCSHXcAAN-qC.jpg,1,chow,0.944032,True,golden_retriever,0.0172398,True,Pomeranian,0.0120848,True,chow
393,"RT @dog_rates: ""Yep... just as I suspected. You're not flossing."" 12/10 and 11/10 for the pup not flossing https://t.co/SuXcI9B7pQ",12.0,10.0,None,,,,,,2016,11,26,21:26:58,3403,0,https://pbs.twimg.com/media/CsrjryzWgAAZY00.jpg,1,cocker_spaniel,0.253442,True,golden_retriever,0.16285,True,otterhound,0.110921,True,cocker_spaniel
394,This is Winnie. She's h*ckin ferocious. Dandelion doesn't even see her coming. 12/10 would pet with caution https://t.co/EFfLCP7oQv,12.0,10.0,Winnie,,,,,,2016,11,26,18:00:13,2926,9959,https://pbs.twimg.com/media/CyNPmJgXcAECPuB.jpg,1,golden_retriever,0.610171,True,Labrador_retriever,0.173252,True,cocker_spaniel,0.1632569999999999,True,golden_retriever
395,"Like doggo, like pupper version 2. Both 11/10 https://t.co/9IxWAXFqze",11.0,10.0,None,doggo,,pupper,,"doggo,pupper",2016,11,25,21:37:47,1573,7039,https://pbs.twimg.com/media/CyI3zXgWEAACQfB.jpg,1,Labrador_retriever,0.8971620000000001,True,beagle,0.0168947999999999,True,Rhodesian_ridgeback,0.0120606,True,Labrador_retriever
396,RT @dog_rates: Everybody drop what you're doing and look at this dog. 13/10 must be super h*ckin rare https://t.co/I1bJUzUEW5,13.0,10.0,None,,,,,,2016,11,25,20:26:31,5247,0,https://pbs.twimg.com/media/Cs_DYr1XEAA54Pu.jpg,1,Chihuahua,0.721188,True,toy_terrier,0.112943,True,kelpie,0.0533644999999999,True,Chihuahua
397,This is Loki. He'll do your taxes for you. Can also make room in your budget for all the things you bought today. 12/10 what a puppo https://t.co/5oWrHCWg87,12.0,10.0,Loki,,,,puppo,puppo,2016,11,25,19:55:35,3040,10132,https://pbs.twimg.com/media/CyIgaTEVEAA-9zS.jpg,2,Eskimo_dog,0.482498,True,Siberian_husky,0.3357739999999999,True,malamute,0.134589,True,Eskimo_dog
398,This is Ronnie. He hopes you're having a great day. Nifty tongue slip. 12/10 would pat head approvingly https://t.co/4fY2bsAm65,12.0,10.0,Ronnie,,,,,,2016,11,25,01:18:59,1992,8608,https://pbs.twimg.com/media/CyEg2AXUsAA1Qpf.jpg,1,Staffordshire_bullterrier,0.327887,True,American_Staffordshire_terrier,0.271916,True,Labrador_retriever,0.247619,True,Staffordshire_bullterrier
399,This is Wallace. He'll be your chau-fur this evening. 12/10 eyes on the road Wallace https://t.co/p1RD39XjUe,12.0,10.0,Wallace,,,,,,2016,11,23,21:29:33,2391,9141,https://pbs.twimg.com/media/Cx-itFWWIAAZu7l.jpg,1,Pembroke,0.550506,True,Cardigan,0.306612,True,Shetland_sheepdog,0.0542299999999999,True,Pembroke
400,This is Bones. He's being haunted by another doggo of roughly the same size. 12/10 deep breaths pupper everything's fine https://t.co/55Dqe0SJNj,12.0,10.0,Bones,doggo,,pupper,,"doggo,pupper",2016,11,22,17:28:25,2429,8992,https://pbs.twimg.com/media/Cx4h7zHUsAAqaJd.jpg,1,dalmatian,0.823356,True,English_setter,0.0946018999999999,True,bluetick,0.0219534,True,dalmatian
401,Say hello to Mauve and Murphy. They're rather h*ckin filthy. Preferred nap over bath. Both 12/10 https://t.co/4UwCTW3lXG,12.0,10.0,Mauve,,,,,,2016,11,21,17:23:47,3214,11701,https://pbs.twimg.com/media/CxzXOyBW8AEu_Oi.jpg,2,cocker_spaniel,0.771984,True,miniature_poodle,0.0766528,True,toy_poodle,0.0396183,True,cocker_spaniel
402,This is Chef. Chef loves everyone and wants everyone to love each other. 11/10 https://t.co/ILHGs0e6Dm,11.0,10.0,Chef,,,,,,2016,11,21,01:37:04,3495,14685,https://pbs.twimg.com/media/Cxv-nkJUoAAhzMt.jpg,1,Pembroke,0.8289040000000001,True,Cardigan,0.167373,True,Chihuahua,0.0007659339999999,True,Pembroke
403,This is Doc. He takes time out of every day to worship our plant overlords. 12/10 quite the floofer https://t.co/azMneS6Ly5,12.0,10.0,Doc,,floofer,,,floofer,2016,11,20,17:20:08,3265,12456,https://pbs.twimg.com/media/CxuM3oZW8AEhO5z.jpg,2,golden_retriever,0.35986,True,Pembroke,0.194207,True,collie,0.154603,True,golden_retriever
404,RT @dog_rates: This is Tucker. He would like a hug. 13/10 someone hug him https://t.co/wdgY9oHPrT,13.0,10.0,Tucker,,,,,,2016,11,19,00:40:24,5488,0,https://pbs.twimg.com/media/CsGnz64WYAEIDHJ.jpg,1,chow,0.316565,True,golden_retriever,0.241929,True,Pomeranian,0.157524,True,chow
405,This is Sobe. She's a h*ckin happy doggo. Only one leg tho. Must have good balance. 13/10 would smile back https://t.co/OiH8PaOxB1,13.0,10.0,Sobe,doggo,,,,doggo,2016,11,18,23:35:32,2506,9390,https://pbs.twimg.com/media/CxlPnoSUcAEXf1i.jpg,1,Border_collie,0.442534,True,collie,0.288684,True,Shetland_sheepdog,0.196399,True,Border_collie
406,This is Longfellow (prolly sophisticated). He's a North Appalachian Oatzenjammer. Concerned about wrinkled feets. 12/10 would hug softly https://t.co/bpLuQuxzHZ,12.0,10.0,Longfellow,,,,,,2016,11,18,01:24:14,2213,8965,https://pbs.twimg.com/media/Cxge6AdUQAAvXLB.jpg,1,miniature_pinscher,0.58363,True,redbone,0.276095,True,toy_terrier,0.0185500999999999,True,miniature_pinscher
407,This is Jeffrey. He's quite the jokester. Takes it too far sometimes. Still 11/10 would pet https://t.co/YDtZcAiMAf,11.0,10.0,Jeffrey,,,,,,2016,11,17,17:04:16,3227,11065,https://pbs.twimg.com/media/CxeseRgUoAM_SQK.jpg,1,malamute,0.985028,True,Siberian_husky,0.00583442,True,Eskimo_dog,0.00544281,True,malamute
408,This is Mister. He only wears the most fashionable af headwear. 11/10 h*ckin stylish https://t.co/BXJFKOVnJm,11.0,10.0,Mister,,,,,,2016,11,17,01:35:54,2863,9058,https://pbs.twimg.com/media/CxbX_n2WIAAHaLS.jpg,2,Norfolk_terrier,0.334436,True,Norwich_terrier,0.231573,True,Australian_terrier,0.214203,True,Norfolk_terrier
409,This is Iroh. He's in a predicament. 12/10 someone help him https://t.co/KJAKO2kXsL,12.0,10.0,Iroh,,,,,,2016,11,16,17:01:16,5203,14712,https://pbs.twimg.com/media/CxZiLcLXUAApMVy.jpg,1,Siberian_husky,0.703224,True,Eskimo_dog,0.229351,True,malamute,0.0443508,True,Siberian_husky
410,This is Shadow. He's a firm believer that they're all good dogs. H*ckin passionate about it too. 11/10 I stand with Shadow https://t.co/8yvpacwBcu,11.0,10.0,Shadow,,,,,,2016,11,16,16:28:21,1663,8246,https://pbs.twimg.com/media/CxZaqh_WQAA7lY3.jpg,1,West_Highland_white_terrier,0.539463,True,cairn,0.184897,True,Norfolk_terrier,0.163024,True,West_Highland_white_terrier
411,RT @dog_rates: This is Stubert. He just arrived. 10/10 https://t.co/HVGs5aAKAn,10.0,10.0,Stubert,,,,,,2016,11,16,01:23:12,7602,0,https://pbs.twimg.com/media/CeRoBaxWEAABi0X.jpg,1,Labrador_retriever,0.8686709999999999,True,carton,0.0950952,False,pug,0.00765137,True,Labrador_retriever
412,"RT @dog_rates: I'm not sure what's happening here, but it's pretty spectacular. 12/10 for both https://t.co/JKXh0NbBNL",12.0,10.0,None,,,,,,2016,11,16,01:09:57,5812,0,https://pbs.twimg.com/media/Cbs3DOAXIAAp3Bd.jpg,1,Chihuahua,0.615163,True,Pembroke,0.1595089999999999,True,basenji,0.0844656999999999,True,Chihuahua
413,RT @dog_rates: This is Lola. She fell asleep on a piece of pizza. 10/10 frighteningly relatable https://t.co/eqmkr2gmPH,10.0,10.0,Lola,,,,,,2016,11,15,23:13:58,4519,0,https://pbs.twimg.com/media/CVMOlMiWwAA4Yxl.jpg,1,chow,0.243529,True,hamster,0.22715,False,Pomeranian,0.0560567,True,chow
414,RT @dog_rates: This is Paull. He just stubbed his toe. 10/10 deep breaths Paull https://t.co/J5Mqn8VeYq,10.0,10.0,Paull,,,,,,2016,11,15,21:49:12,2153,0,https://pbs.twimg.com/media/CU3mITUWIAAfyQS.jpg,1,English_springer,0.403698,True,Brittany_spaniel,0.347609,True,Welsh_springer_spaniel,0.137186,True,English_springer
415,RT @dog_rates: This a Norwegian Pewterschmidt named Tickles. Ears for days. 12/10 I care deeply for Tickles https://t.co/0aDF62KVP7,12.0,10.0,None,,,,,,2016,11,15,20:47:30,2272,0,https://pbs.twimg.com/media/CUN4Or5UAAAa5K4.jpg,1,beagle,0.636169,True,Labrador_retriever,0.119256,True,golden_retriever,0.0825491999999999,True,beagle
416,RT @dog_rates: This is Davey. He'll have your daughter home by 8. Just a stand up pup. 11/10 would introduce to mom https://t.co/E6bGWf9EOm,11.0,10.0,Davey,,,,,,2016,11,15,01:44:00,3924,0,https://pbs.twimg.com/media/CrXhIqBW8AA6Bse.jpg,1,papillon,0.53318,True,collie,0.192031,True,Border_collie,0.121626,True,papillon
417,This is Cooper. His bow tie was too heavy for the front so he moved it to the side. Balanced af now. 13/10 https://t.co/jG1PAFkB81,13.0,10.0,Cooper,,,,,,2016,11,14,17:03:50,2954,11548,https://pbs.twimg.com/media/CxPPnCYWIAAo_ao.jpg,1,Pekinese,0.524583,True,Shih-Tzu,0.102931,True,Pomeranian,0.0978931,True,Pekinese
418,Here's a helicopter pupper. He takes off at random. H*ckin hard to control. 12/10 rare af https://t.co/GRWPgNKt2z,12.0,10.0,None,,,pupper,,pupper,2016,11,14,01:18:12,3652,13018,https://pbs.twimg.com/media/CxL3IWeVEAAAIE2.jpg,1,American_Staffordshire_terrier,0.489845,True,Chihuahua,0.30576,True,Staffordshire_bullterrier,0.0727991,True,American_Staffordshire_terrier
419,This is Cassie. She steals things. Guilt increases slightly each time. 12/10 would forgive almost immediately https://t.co/Ia19irLwyB,12.0,10.0,Cassie,,,,,,2016,11,12,21:02:38,5656,16198,https://pbs.twimg.com/media/CxFzFAAUAAA5C9z.jpg,1,Pembroke,0.954089,True,Cardigan,0.0336439,True,papillon,0.00973566,True,Pembroke
420,This is Pancake. She loves Batman and winks like a h*ckin champ. 12/10 real crowd pleaser https://t.co/6kqsAjJNhi,12.0,10.0,Pancake,,,,,,2016,11,12,00:36:46,7726,22328,https://pbs.twimg.com/media/CxBafisWQAAtJ1X.jpg,2,collie,0.767005,True,Border_collie,0.100844,True,kelpie,0.0483681,True,collie
421,This is Tyr. He's just checking on you. Nifty af tongue slip. 12/10 would absolutely pet https://t.co/Jgnuiyvq06,12.0,10.0,Tyr,,,,,,2016,11,11,00:03:42,2198,8564,https://pbs.twimg.com/media/Cw8JWZ2UsAAJOZ6.jpg,1,Cardigan,0.8391290000000001,True,Boston_bull,0.0806985,True,Pembroke,0.034505,True,Cardigan
422,Say hello to Romeo. He was just told that it's too cold for the pool. H*ckin nonsense. 11/10 would help fill up https://t.co/6hx7ur6sNI,11.0,10.0,Romeo,,,,,,2016,11,10,17:02:03,3562,13256,https://pbs.twimg.com/media/Cw6o1JQXcAAtP78.jpg,1,American_Staffordshire_terrier,0.463996,True,Staffordshire_bullterrier,0.155566,True,Weimaraner,0.137587,True,American_Staffordshire_terrier
423,Here's a sleepy doggo that requested some assistance. 12/10 would carry everywhere https://t.co/bvkkqOjNDV,12.0,10.0,None,doggo,,,,doggo,2016,11,9,22:49:15,2042,8472,https://pbs.twimg.com/media/Cw2uty8VQAAB0pL.jpg,1,cocker_spaniel,0.116924,True,seat_belt,0.107511,False,Australian_terrier,0.0998434,True,cocker_spaniel
424,This is Snicku. He's having trouble reading because he's a dog. Glasses only helped a little. Nap preferred. 12/10 would snug well https://t.co/cVLUasbKA5,12.0,10.0,Snicku,,,,,,2016,11,9,16:22:22,4861,12334,https://pbs.twimg.com/media/Cw1WKu1UQAAvWsu.jpg,1,Pekinese,0.461164,True,Pomeranian,0.28865,True,Siamese_cat,0.052423,False,Pekinese
425,RT @dog_rates: This is Ruby. She just turned on the news. Officially terrified. 11/10 deep breaths Ruby https://t.co/y5KarNXWXt,11.0,10.0,Ruby,,,,,,2016,11,9,02:29:25,16628,0,https://pbs.twimg.com/media/Cwx99rpW8AMk_Ie.jpg,1,golden_retriever,0.600276,True,Labrador_retriever,0.140798,True,seat_belt,0.0873548,False,golden_retriever
426,I didn't believe it at first but now I can see that voter fraud is a serious h*ckin issue. 11/10 https://t.co/7i0bDMbrVN,11.0,10.0,None,,,,,,2016,11,8,22:25:27,2813,10139,https://pbs.twimg.com/media/CwxfrguUUAA1cbl.jpg,1,Cardigan,0.700182,True,Pembroke,0.260738,True,papillon,0.0171099,True,Cardigan
427,This is Yogi. He's 98% floof. Snuggable af. 12/10 https://t.co/opoXKxmfFm,12.0,10.0,Yogi,,,,,,2016,11,8,20:00:55,2703,9469,https://pbs.twimg.com/media/Cww-msrXcAAxm3K.jpg,1,chow,0.973846,True,Tibetan_mastiff,0.0141098999999999,True,gibbon,0.00235832,False,chow
428,This is Daisy. She's here to make your day better. 13/10 mission h*ckin successful https://t.co/PbgvuD0qIL,13.0,10.0,Daisy,,,,,,2016,11,8,16:47:50,4284,12071,https://pbs.twimg.com/media/CwwSaWJWIAASuoY.jpg,1,golden_retriever,0.893775,True,Labrador_retriever,0.0701398,True,doormat,0.00841853,False,golden_retriever
429,Elder doggo does a splash. Both 13/10 incredible stuff https://t.co/gBUDjdEcqz,13.0,10.0,None,doggo,,,,doggo,2016,11,7,03:14:10,27728,55683,https://pbs.twimg.com/ext_tw_video_thumb/795464066940764160/pu/img/jPkMMQXdydb7CqFX.jpg,1,golden_retriever,0.193082,True,Chesapeake_Bay_retriever,0.157927,True,soft-coated_wheaten_terrier,0.1246839999999999,True,golden_retriever
430,This is Brody. He's trying to make the same face as the football. 12/10 https://t.co/2H4MfOGlpQ,12.0,10.0,Brody,,,,,,2016,11,6,22:59:35,3323,11270,https://pbs.twimg.com/media/CwnUUGTWIAE8sFR.jpg,2,golden_retriever,0.925494,True,Labrador_retriever,0.0592408,True,tennis_ball,0.00449534,False,golden_retriever
431,RT @dog_rates: This is Rizzy. She smiles a lot. 12/10 contagious af https://t.co/TU4sZogVIq,12.0,10.0,Rizzy,,,,,,2016,11,5,19:24:28,3942,0,https://pbs.twimg.com/media/CvT6IV6WEAQhhV5.jpg,3,schipperke,0.363272,True,kelpie,0.197021,True,Norwegian_elkhound,0.151024,True,schipperke
432,This is Mack. He's rather h*ckin sleepy. Exceptional ears. 12/10 would boop https://t.co/XRPvTPF0VH,12.0,10.0,Mack,,,,,,2016,11,5,15:37:24,2697,11492,https://pbs.twimg.com/media/CwglhZVXgAAc3_w.jpg,1,teddy,0.569566,False,bath_towel,0.173745,False,toy_poodle,0.0376618,True,toy_poodle
433,RT @dog_rates: This is Butter. She can have whatever she wants forever. 12/10 would hug softly https://t.co/x5gXRS1abq,12.0,10.0,Butter,,,,,,2016,11,4,01:48:22,12014,0,https://pbs.twimg.com/media/CvJCabcWgAIoUxW.jpg,1,cocker_spaniel,0.500509,True,golden_retriever,0.272734,True,jigsaw_puzzle,0.0414758,False,cocker_spaniel
434,This is Nimbus (like the cloud). He just bought this fancy af duck raincoat. Only protects one ear tho. 12/10 so h*ckin floofy https://t.co/SIQbb8c3AU,12.0,10.0,Nimbus,,,,,,2016,11,4,00:15:59,3088,10686,https://pbs.twimg.com/media/CwYJBiHXgAQlvrh.jpg,1,Samoyed,0.988307,True,malamute,0.00490635,True,Great_Pyrenees,0.00290129,True,Samoyed
435,This is Clark. He was just caught wearing pants. 13/10 game-changing af https://t.co/2Xo19aPrG5,13.0,10.0,Clark,,,,,,2016,11,2,16:00:06,2187,10295,https://pbs.twimg.com/media/CwRN8H6WgAASe4X.jpg,1,Old_English_sheepdog,0.7652770000000001,True,Bedlington_terrier,0.1127529999999999,True,Kerry_blue_terrier,0.0476616999999999,True,Old_English_sheepdog
436,RT @dog_rates: When she says you're a good boy and you know you're a good boy because you're a good boy. 13/10 https://t.co/O5IUmRHRIh,13.0,10.0,None,,,,,,2016,11,2,00:42:53,3661,0,https://pbs.twimg.com/media/CvyVxQRWEAAdSZS.jpg,1,golden_retriever,0.705092,True,Labrador_retriever,0.219721,True,kuvasz,0.015965,True,golden_retriever
437,This is Dobby. I can't stop looking at her feet. 12/10 would absolutely snug https://t.co/LhzPWv6rTv,12.0,10.0,Dobby,,,,,,2016,11,1,23:53:02,1908,8926,https://pbs.twimg.com/media/CwNwmxvXEAEJ54Z.jpg,1,miniature_pinscher,0.538981,True,Chihuahua,0.21783,True,toy_terrier,0.0891487,True,miniature_pinscher
438,This is Fiona. She's an extremely mediocre copilot. Very distracting. Wink makes up for all the missed turns. 12/10 https://t.co/aF5MmpvPqN,12.0,10.0,Fiona,,,,,,2016,11,1,17:12:16,2786,11953,https://pbs.twimg.com/media/CwMU34YWIAAz1nU.jpg,2,golden_retriever,0.3261219999999999,True,Labrador_retriever,0.219904,True,Chesapeake_Bay_retriever,0.163366,True,golden_retriever
439,Meet Dave. It's his favorite day of the year. He gets to fulfill his dream of being a dinosaur. 12/10 inspirational af https://t.co/MgQSdfZGPN,12.0,10.0,Dave,,,,,,2016,11,1,02:00:14,2763,9677,https://pbs.twimg.com/media/CwJEIKTWYAAvL-T.jpg,1,Siberian_husky,0.2316949999999999,True,Eskimo_dog,0.206749,True,Pembroke,0.0701195,True,Siberian_husky
440,Oh h*ck look at this spookling right here. Fright level off the charts. 12/10 sufficiently spooked https://t.co/BNy9IIJMb0,12.0,10.0,None,,,,,,2016,11,1,01:00:05,9714,22350,https://pbs.twimg.com/media/CwI2XCvXEAEO8mc.jpg,1,basset,0.2076219999999999,True,Walker_hound,0.0605741999999999,True,beagle,0.0412205,True,basset
441,This is Tucker. He's out here bustin h*ckin ghosts. 13/10 dedicated af https://t.co/Ap477GhwXt,13.0,10.0,Tucker,,,,,,2016,11,1,00:00:38,3812,11780,https://pbs.twimg.com/media/CwIougTWcAAMLyq.jpg,1,golden_retriever,0.559308,True,Labrador_retriever,0.3902219999999999,True,cocker_spaniel,0.0363157,True,golden_retriever
