,text,rating_numerator,rating_denominator,name,doggo,floofer,pupper,puppo,stage,year,month,day,time,retweet_count,favorite_count,jpg_url,img_num,p1,p1_conf,p1_dog,p2,p2_conf,p2_dog,p3,p3_conf,p3_dog,dog_type
0,"This is Tilly. She's just checking pup on you. Hopes you're doing ok. If not, she's available for pats, snugs, boops, the whole bit. 13/10 https://t.co/0Xxu71qeIV",13.0,10.0,Tilly,,,,,,2017,8,1,00:17:27,6514,33819,https://pbs.twimg.com/media/DGGmoV4XsAAUL6n.jpg,1,Chihuahua,0.323581,True,Pekinese,0.0906465,True,papillon,0.0689569,True,Chihuahua
1,This is Archie. He is a rare Norwegian Pouncing Corgo. Lives in the tall grass. You never know when one may strike. 12/10 https://t.co/wUnZnhtVJB,12.0,10.0,Archie,,,,,,2017,7,31,00:18:03,4328,25461,https://pbs.twimg.com/media/DGBdLU1WsAANxJ9.jpg,1,Chihuahua,0.716012,True,malamute,0.078253,True,kelpie,0.0313789,True,Chihuahua
2,This is Darla. She commenced a snooze mid meal. 13/10 happens to the best of us https://t.co/tD36da7qLQ,13.0,10.0,Darla,,,,,,2017,7,30,15:58:51,8964,42908,https://pbs.twimg.com/media/DF_q7IAWsAEuuN8.jpg,1,paper_towel,0.1702779999999999,False,Labrador_retriever,0.1680859999999999,True,spatula,0.0408359,False,Labrador_retriever
3,"This is Franklin. He would like you to stop calling him ""cute."" He is a very fierce shark and should be respected as such. 12/10 #BarkWeek https://t.co/AtUZn91f7f",12.0,10.0,Franklin,,,,,,2017,7,29,16:00:24,9774,41048,https://pbs.twimg.com/media/DF6hr6BUMAAzZgT.jpg,2,basset,0.555712,True,English_springer,0.2257699999999999,True,German_short-haired_pointer,0.175219,True,basset
4,Here we have a majestic great white breaching off South Africa's coast. Absolutely h*ckin breathtaking. 13/10 (IG: tucker_marlo) #BarkWeek https://t.co/kQ04fDDRmh,13.0,10.0,None,,,,,,2017,7,29,00:08:17,3261,20562,https://pbs.twimg.com/media/DF3HwyEWsAABqE6.jpg,1,Chesapeake_Bay_retriever,0.425595,True,Irish_terrier,0.116317,True,Indian_elephant,0.0769021999999999,False,Chesapeake_Bay_retriever
5,"Meet Jax. He enjoys ice cream so much he gets nervous around it. 13/10 help Jax enjoy more things by clicking below

https://t.co/Zr4hWfAs1H https://t.co/tVJBRMnhxl",13.0,10.0,Jax,,,,,,2017,7,28,16:27:12,2158,12041,https://pbs.twimg.com/media/DF1eOmZXUAALUcq.jpg,1,Appenzeller,0.341703,True,Border_collie,0.199287,True,ice_lolly,0.193548,False,Appenzeller
6,When you watch your owner call another dog a good boy but then they turn back to you and say you're a great boy. 13/10 https://t.co/v0nONBcwxq,13.0,10.0,None,,,,,,2017,7,28,00:22:40,16716,56848,https://pbs.twimg.com/media/DFyBahAVwAAhUTd.jpg,2,Pomeranian,0.566142,True,Eskimo_dog,0.1784059999999999,True,Pembroke,0.0765069,True,Pomeranian
7,This is Zoey. She doesn't want to be one of the scary sharks. Just wants to be a snuggly pettable boatpet. 13/10 #BarkWeek https://t.co/9TwLuAGH0b,13.0,10.0,Zoey,,,,,,2017,7,27,16:25:51,4429,28226,https://pbs.twimg.com/media/DFwUU__XcAEpyXI.jpg,1,Irish_terrier,0.4875739999999999,True,Irish_setter,0.193054,True,Chesapeake_Bay_retriever,0.118184,True,Irish_terrier
8,This is Cassie. She is a college pup. Studying international doggo communication and stick theory. 14/10 so elegant much sophisticate https://t.co/t1bfwz5S2A,14.0,10.0,Cassie,doggo,,,,doggo,2017,7,26,15:59:51,7711,32467,https://pbs.twimg.com/media/DFrEyVuW0AAO3t9.jpg,1,Pembroke,0.511319,True,Cardigan,0.451038,True,Chihuahua,0.0292482,True,Pembroke
9,This is Koda. He is a South Australian deckshark. Deceptively deadly. Frighteningly majestic. 13/10 would risk a petting #BarkWeek https://t.co/dVPW0B0Mme,13.0,10.0,Koda,,,,,,2017,7,26,00:31:25,7624,31166,https://pbs.twimg.com/media/DFnwSY4WAAAMliS.jpg,1,Samoyed,0.957979,True,Pomeranian,0.0138835,True,chow,0.00816748,True,Samoyed
10,This is Bruno. He is a service shark. Only gets out of the water to assist you. 13/10 terrifyingly good boy https://t.co/u1XPQMl29g,13.0,10.0,Bruno,,,,,,2017,7,25,16:11:53,5156,28268,https://pbs.twimg.com/media/DFl99B1WsAITKsg.jpg,1,French_bulldog,0.377417,True,Labrador_retriever,0.151317,True,muzzle,0.0829811,False,French_bulldog
11,Here's a puppo that seems to be on the fence about something haha no but seriously someone help her. 13/10 https://t.co/BxvuXk0UCm,13.0,10.0,None,,,,puppo,puppo,2017,7,25,01:55:32,8538,38818,https://pbs.twimg.com/media/DFi579UWsAAatzw.jpg,1,Pembroke,0.966327,True,Cardigan,0.0273557,True,basenji,0.00463323,True,Pembroke
12,This is Ted. He does his best. Sometimes that's not enough. But it's ok. 12/10 would assist https://t.co/f8dEDcrKSR,12.0,10.0,Ted,,,,,,2017,7,25,00:10:02,4735,27672,https://pbs.twimg.com/media/DFihzFfXsAYGDPR.jpg,1,French_bulldog,0.99165,True,boxer,0.00212864,True,Staffordshire_bullterrier,0.00149818,True,French_bulldog
13,This is Stuart. He's sporting his favorite fanny pack. Secretly filled with bones only. 13/10 puppared puppo #BarkWeek https://t.co/y70o6h3isq,13.0,10.0,Stuart,,,,puppo,puppo,2017,7,24,17:02:04,2321,15359,https://pbs.twimg.com/media/DFg_2PVW0AEHN3p.jpg,1,golden_retriever,0.953442,True,Labrador_retriever,0.0138341,True,redbone,0.00795775,True,golden_retriever
14,This is Oliver. You're witnessing one of his many brutal attacks. Seems to be playing with his victim. 13/10 fr*ckin frightening #BarkWeek https://t.co/WpHvrQedPb,13.0,10.0,Oliver,,,,,,2017,7,24,00:19:32,5637,25652,https://pbs.twimg.com/ext_tw_video_thumb/889278779352338437/pu/img/VlbFB3v8H8VwzVNY.jpg,1,whippet,0.626152,True,borzoi,0.194742,True,Saluki,0.0273507,True,whippet
15,This is Jim. He found a fren. Taught him how to sit like the good boys. 12/10 for both https://t.co/chxruIOUJN,12.0,10.0,Jim,,,,,,2017,7,23,00:22:39,4709,29611,https://pbs.twimg.com/media/DFYRgsOUQAARGhO.jpg,1,golden_retriever,0.714719,True,Tibetan_mastiff,0.1201839999999999,True,Labrador_retriever,0.1055059999999999,True,golden_retriever
16,This is Zeke. He has a new stick. Very proud of it. Would like you to throw it for him without taking it. 13/10 would do my best https://t.co/HTQ77yNQ5K,13.0,10.0,Zeke,,,,,,2017,7,22,16:56:37,4559,26080,https://pbs.twimg.com/media/DFWra-3VYAA2piG.jpg,1,golden_retriever,0.46976,True,Labrador_retriever,0.184172,True,English_setter,0.0734817,True,golden_retriever
17,This is Ralphus. He's powering up. Attempting maximum borkdrive. 13/10 inspirational af https://t.co/YnYAFCTTiK,13.0,10.0,Ralphus,,,,,,2017,7,22,00:23:06,3732,20290,https://pbs.twimg.com/media/DFTH_O-UQAACu20.jpg,3,Siberian_husky,0.700377,True,Eskimo_dog,0.166511,True,malamute,0.111411,True,Siberian_husky
18,This is Gerald. He was just told he didn't get the job he interviewed for. A h*ckin injustice. 12/10 didn't want the job anyway https://t.co/DK7iDPfuRX,12.0,10.0,Gerald,,,,,,2017,7,20,16:49:33,3653,22201,https://pbs.twimg.com/media/DFMWn56WsAAkA7B.jpg,1,French_bulldog,0.995026,True,pug,0.000931908,True,bull_mastiff,0.000903211,True,French_bulldog
19,This is Jeffrey. He has a monopoly on the pool noodles. Currently running a 'boop for two' midweek sale. 13/10 h*ckin strategic https://t.co/PhrUk20Q64,13.0,10.0,Jeffrey,,,,,,2017,7,19,16:06:48,5609,30779,https://pbs.twimg.com/media/DFHDQBbXgAEqY7t.jpg,1,basset,0.821664,True,redbone,0.0875815,True,Weimaraner,0.0262364,True,basset
20,You may not have known you needed to see this today. 13/10 please enjoy (IG: emmylouroo) https://t.co/WZqNqygEyV,13.0,10.0,None,,,,,,2017,7,18,16:08:03,10737,34222,https://pbs.twimg.com/ext_tw_video_thumb/887343120832229379/pu/img/6HSuFrW1lzI_9Mht.jpg,1,Mexican_hairless,0.330741,True,sea_lion,0.275645,False,Weimaraner,0.134203,True,Mexican_hairless
21,This... is a Jubilant Antarctic House Bear. We only rate dogs. Please only send dogs. Thank you... 12/10 would suffocate in floof https://t.co/4Ad1jzJSdp,12.0,10.0,None,,,,,,2017,7,18,00:07:08,6167,31061,https://pbs.twimg.com/media/DE-eAq6UwAA-jaE.jpg,1,Samoyed,0.733942,True,Eskimo_dog,0.0350295,True,Staffordshire_bullterrier,0.0297047,True,Samoyed
22,This is Maya. She's very shy. Rarely leaves her cup. 13/10 would find her an environment to thrive in https://t.co/I6oNy0CgiT,13.0,10.0,Maya,,,,,,2017,7,17,16:17:36,8084,35859,https://pbs.twimg.com/media/DE8yicJW0AAAvBJ.jpg,2,Chihuahua,0.793469,True,toy_terrier,0.143528,True,can_opener,0.0322529,False,Chihuahua
23,"This is Mingus. He's a wonderful father to his smol pup. Confirmed 13/10, but he needs your help

https://t.co/bVi0Yr4Cff https://t.co/ISvKOSkd5b",13.0,10.0,Mingus,,,,,,2017,7,16,23:58:41,3443,12306,https://pbs.twimg.com/media/DE5Se8FXcAAJFx4.jpg,1,kuvasz,0.309706,True,Great_Pyrenees,0.186136,True,Dandie_Dinmont,0.0863463,True,kuvasz
24,This is Roscoe. Another pupper fallen victim to spontaneous tongue ejections. Get the BlepiPen immediate. 12/10 deep breaths Roscoe https://t.co/RGE08MIJox,12.0,10.0,Roscoe,,,pupper,,pupper,2017,7,15,23:25:31,3316,21524,https://pbs.twimg.com/media/DE0BTnQUwAApKEH.jpg,1,French_bulldog,0.999201,True,Chihuahua,0.000361178,True,Boston_bull,7.55616e-05,True,French_bulldog
25,This is Waffles. His doggles are pupside down. Unsure how to fix. 13/10 someone assist Waffles https://t.co/xZDA9Qsq1O,13.0,10.0,Waffles,,,,,,2017,7,15,16:17:19,6523,28469,https://pbs.twimg.com/media/DEyfTG4UMAE4aE9.jpg,1,pug,0.943575,True,shower_cap,0.0252856,False,Siamese_cat,0.00284892,False,pug
26,Viewer discretion advised. This is Jimbo. He will rip ur finger right h*ckin off. Other dog clearly an accessory. 12/10 pls pet with caution https://t.co/BuveP0uMF1,12.0,10.0,Jimbo,,,,,,2017,7,14,22:10:11,7097,33382,https://pbs.twimg.com/media/DEumeWWV0AA-Z61.jpg,1,Blenheim_spaniel,0.972494,True,Shih-Tzu,0.00663012,True,Bernese_mountain_dog,0.00623915,True,Blenheim_spaniel
27,This is Maisey. She fell asleep mid-excavation. Happens to the best of us. 13/10 would pat noggin approvingly https://t.co/tp1kQ8i9JF,13.0,10.0,Maisey,,,,,,2017,7,13,15:58:47,6683,36689,https://pbs.twimg.com/media/DEoH3yvXgAAzQtS.jpg,1,pug,0.369275,True,Labrador_retriever,0.265835,True,kuvasz,0.134697,True,pug
28,RT @dog_rates: This is Lilly. She just parallel barked. Kindly requests a reward now. 13/10 would pet so well https://t.co/SATN4If5H5,13.0,10.0,Lilly,,,,,,2017,7,13,01:35:06,19297,0,https://pbs.twimg.com/media/C4bTH6nWMAAX_bJ.jpg,1,Labrador_retriever,0.908703,True,seat_belt,0.0570909,False,pug,0.0119335,True,Labrador_retriever
29,Here we have a corgi undercover as a malamute. Pawbably doing important investigative work. Zero control over tongue happenings. 13/10 https://t.co/44ItaMubBf,13.0,10.0,None,,,,,,2017,7,12,16:03:00,4556,22367,https://pbs.twimg.com/media/DEi_N9qXYAAgEEw.jpg,4,malamute,0.8124819999999999,True,Siberian_husky,0.0717125,True,Eskimo_dog,0.0557697,True,malamute
30,"This is Earl. He found a hat. Nervous about what you think of it. 12/10 it's delightful, Earl https://t.co/MYJvdlNRVa",12.0,10.0,Earl,,,,,,2017,7,12,00:01:00,16439,68152,https://pbs.twimg.com/media/DEfjEaNXkAAtPlj.jpg,1,Italian_greyhound,0.259916,True,American_Staffordshire_terrier,0.198451,True,Staffordshire_bullterrier,0.127725,True,Italian_greyhound
31,This is Lola. It's her first time outside. Must test the earth and taste the atmosphere. 13/10 you're doing great Lola https://t.co/74TKAUsLkO,13.0,10.0,Lola,,,,,,2017,7,11,20:47:12,6096,28514,https://pbs.twimg.com/media/DEe2tZXXkAAwyX3.jpg,1,chow,0.822103,True,Norwich_terrier,0.106075,True,Norfolk_terrier,0.0373485,True,chow
32,This is Kevin. He's just so happy. 13/10 what is your secret Kevin https://t.co/1r4MFCbCX5,13.0,10.0,Kevin,,,,,,2017,7,11,00:00:02,5100,24765,https://pbs.twimg.com/media/DEaZQkfXUAEC7qB.jpg,1,pug,0.5464060000000001,True,French_bulldog,0.404291,True,Brabancon_griffon,0.0440019,True,pug
33,"I present to you, Pup in Hat. Pup in Hat is great for all occasions. Extremely versatile. Compact as h*ck. 14/10 (IG: itselizabethgales) https://t.co/vvBOcC2VdC",14.0,10.0,None,,,,,,2017,7,10,15:58:53,5856,27478,https://pbs.twimg.com/media/DEYrIZwWsAA2Wo5.jpg,1,Pembroke,0.993225,True,Cardigan,0.00321648,True,Chihuahua,0.00208089,True,Pembroke
34,Meet Yogi. He doesn't have any important dog meetings today he just enjoys looking his best at all times. 12/10 for dangerously dapper doggo https://t.co/YSI00BzTBZ,12.0,10.0,Yogi,doggo,,,,doggo,2017,7,9,21:29:42,3128,20771,https://pbs.twimg.com/media/DEUtQbzW0AUTv_o.jpg,1,German_shepherd,0.707046,True,malinois,0.199396,True,Norwegian_elkhound,0.0491476,True,German_shepherd
35,This is Noah. He can't believe someone made this mess. Got the vacuum out for you though. Offered to help clean pup. 12/10 super good boy https://t.co/V85xujjDDY,12.0,10.0,Noah,,,,,,2017,7,9,00:00:04,3586,22349,https://pbs.twimg.com/media/DEQGFgAXUAAEvfi.jpg,1,Doberman,0.610946,True,miniature_pinscher,0.299603,True,kelpie,0.0630203,True,Doberman
36,"This is Bella. She hopes her smile made you smile. If not, she is also offering you her favorite monkey. 13.5/10 https://t.co/qjrljjt948",5.0,10.0,Bella,,,,,,2017,7,8,00:28:19,10407,46860,https://pbs.twimg.com/media/DELC9dZXUAADqUk.jpg,1,golden_retriever,0.943082,True,Labrador_retriever,0.032409,True,kuvasz,0.00550072,True,golden_retriever
37,Meet Grizzwald. He may be the floofiest floofer I ever did see. Lost eyes saving a schoolbus from a volcano erpuption. 13/10 heroic as h*ck https://t.co/rf661IFEYP,13.0,10.0,Grizzwald,,floofer,,,floofer,2017,7,7,16:22:55,3825,22986,https://pbs.twimg.com/media/DEJT3FeXoAAtwUy.jpg,1,chow,0.987997,True,Tibetan_mastiff,0.00709872,True,Newfoundland,0.00214033,True,chow
38,"Please only send dogs. We don't rate mechanics, no matter how h*ckin good. Thank you... 13/10 would sneak a pat https://t.co/Se5fZ9wp5E",13.0,10.0,None,,,,,,2017,7,7,00:17:54,6949,37914,https://pbs.twimg.com/media/DEF2-_hXoAAs62q.jpg,2,golden_retriever,0.949562,True,Labrador_retriever,0.0459479,True,kuvasz,0.00247094,True,golden_retriever
39,This is Rusty. He wasn't ready for the first pic. Clearly puppared for the second. 13/10 confirmed great boy https://t.co/tyER0KpdXj,13.0,10.0,Rusty,,,,,,2017,7,6,15:58:11,4122,24445,https://pbs.twimg.com/media/DEEEnIqXYAAiJh_.jpg,1,Eskimo_dog,0.4667779999999999,True,Siberian_husky,0.406044,True,dingo,0.0734143999999999,False,Eskimo_dog
40,This is Gus. He's quite the cheeky pupper. Already perfected the disinterested wink. 12/10 would let steal my girl https://t.co/D43I96SlVu,12.0,10.0,Gus,,,pupper,,pupper,2017,7,6,00:46:41,5134,28903,https://pbs.twimg.com/media/DEAz_HHXsAA-p_z.jpg,1,Labrador_retriever,0.85005,True,Chesapeake_Bay_retriever,0.074257,True,flat-coated_retriever,0.0155793999999999,True,Labrador_retriever
41,This is Stanley. He has his first swim lesson today. Doggle straps adjusted. Ready to go. 13/10 Phelps is nervous (IG: stanleythe_corgi) https://t.co/Nx52PGwH94,13.0,10.0,Stanley,,,,,,2017,7,5,15:48:34,6342,28382,https://pbs.twimg.com/media/DD-40X3WAAAJPU5.jpg,1,Pembroke,0.542982,True,Chihuahua,0.251988,True,Cardigan,0.107699,True,Pembroke
42,This is Alfy. You're witnessing his first watermelon experience. I think it was a success. 13/10 happy 4th Alfy ðŸ‡ºðŸ‡¸ https://t.co/fYP5RlutfA,13.0,10.0,Alfy,,,,,,2017,7,4,16:01:23,12118,45880,https://pbs.twimg.com/media/DD5yKdPW0AArzX8.jpg,1,golden_retriever,0.762211,True,Labrador_retriever,0.0989848999999999,True,cocker_spaniel,0.0171995,True,golden_retriever
43,"This is Koko. Her owner, inspired by Barney, recently built a cart for her to use during walks if she got tired. 13/10 rest easy Koko https://t.co/zeDpnsKX7w",13.0,10.0,Koko,,,,,,2017,7,4,01:18:17,5203,29900,https://pbs.twimg.com/media/DD2oCl2WAAEI_4a.jpg,1,web_site,0.949591,False,dhole,0.0173258,False,golden_retriever,0.00694063,True,golden_retriever
44,This is Rey. He's a Benebop Cumberfloof. 12/10 dangerously pettable https://t.co/503CgWbhxQ,12.0,10.0,Rey,,,,,,2017,7,3,16:04:48,3533,24773,https://pbs.twimg.com/media/DD0pWm9XcAAeSBL.jpg,1,Weimaraner,0.291539,True,Chesapeake_Bay_retriever,0.278966,True,koala,0.127017,False,Weimaraner
45,This is Gary. He couldn't miss this puppertunity for a selfie. Flawless focusing skills. 13/10 would boop intensely https://t.co/7CSWCl8I6s,13.0,10.0,Gary,,,,,,2017,7,3,00:11:11,11099,51522,https://pbs.twimg.com/media/DDxPFwbWAAEbVVR.jpg,1,Saluki,0.529012,True,Afghan_hound,0.250003,True,golden_retriever,0.160739,True,Saluki
46,"Here is a pupper approaching maximum borkdrive. Zooming at never before seen speeds. 14/10 paw-inspiring af 
(IG: puffie_the_chow) https://t.co/ghXBIIeQZF",14.0,10.0,a,,,pupper,,pupper,2017,7,2,15:32:16,16570,50199,https://pbs.twimg.com/ext_tw_video_thumb/881535971568889856/pu/img/9bawiZ--8FKywTkz.jpg,1,Samoyed,0.281463,True,Angora,0.272066,False,Persian_cat,0.114854,False,Samoyed
47,Ugh not again. We only rate dogs. Please don't send in well-dressed  floppy-tongued street penguins. Dogs only please. Thank you... 12/10 https://t.co/WiAMbTkDPf,12.0,10.0,None,,,,,,2017,6,30,19:35:32,3989,21734,https://pbs.twimg.com/media/DDl8zzJW0AAisCJ.jpg,1,Pembroke,0.791416,True,Norwich_terrier,0.0613929,True,Chihuahua,0.0337257,True,Pembroke
48,This is Bella. She had her first beach experience this morning. Complete success. 12/10 would perform a sandy boop https://t.co/4VsFysDmiw,12.0,10.0,Bella,,,,,,2017,6,29,16:39:47,6546,29075,https://pbs.twimg.com/media/DDgK-J4XUAIEV9W.jpg,1,golden_retriever,0.913255,True,Labrador_retriever,0.0263286,True,cocker_spaniel,0.00937082,True,golden_retriever
49,Meet Jesse. He's a Fetty Woof. His tongue ejects without warning. A true bleptomaniac. 12/10 would snug well https://t.co/fUod0tVmvK,12.0,10.0,Jesse,,,,,,2017,6,29,00:27:25,4436,27640,https://pbs.twimg.com/media/DDcscbXU0AIfDzs.jpg,1,Chihuahua,0.238525,True,meerkat,0.104256,False,clumber,0.0525802999999999,True,Chihuahua
50,Please don't send in photos without dogs in them. We're not @porch_rates. Insubordinate and churlish. Pretty good porch tho 11/10 https://t.co/HauE8M3Bu4,11.0,10.0,None,,,,,,2017,6,28,16:09:20,4533,28150,https://pbs.twimg.com/media/DDa6ckbXgAAM1vV.jpg,1,miniature_pinscher,0.120298,True,Rhodesian_ridgeback,0.106395,True,beagle,0.106073,True,miniature_pinscher
51,This is Romeo. He would like to do an entrance. Requesting your immediate assistance. 13/10 https://t.co/Qh5aEkRQm9,13.0,10.0,Romeo,,,,,,2017,6,28,00:42:13,3642,22667,https://pbs.twimg.com/media/DDXmPrbWAAEKMvy.jpg,3,basset,0.813507,True,beagle,0.146654,True,cocker_spaniel,0.00948502,True,basset
52,This is Bailey. He thinks you should measure ear length for signs of growth instead. 12/10 https://t.co/IxM9IMKQq8,12.0,10.0,Bailey,,,,,,2017,6,27,00:10:17,3323,23822,https://pbs.twimg.com/media/DDSVWMvXsAEgmMK.jpg,1,German_short-haired_pointer,0.479896,True,vizsla,0.1243529999999999,True,bath_towel,0.0733202,False,German_short-haired_pointer
53,This is Duddles. He did an attempt. 13/10 someone help him (vid by Georgia Felici) https://t.co/UDT7ZkcTgY,13.0,10.0,Duddles,,,,,,2017,6,26,19:07:24,45849,107956,https://pbs.twimg.com/ext_tw_video_thumb/879415784908390401/pu/img/cX7XI1TnUsseGET5.jpg,1,English_springer,0.383404,True,Boston_bull,0.134967,True,Cardigan,0.110481,True,English_springer
54,This is Jack AKA Stephen Furry. You're not scoring on him. Unless he slips down the slide. 12/10 would happily get blocked by https://t.co/0gOi601EAa,12.0,10.0,Jack,,,,,,2017,6,26,16:31:08,3261,17099,https://pbs.twimg.com/media/DDQsQGFV0AAw6u9.jpg,1,tricycle,0.663601,False,Labrador_retriever,0.0334961,True,Pembroke,0.0188266,True,Labrador_retriever
55,This is Beau. That is Beau's balloon. He takes it everywhere. 13/10 would protect at all costs https://t.co/YDtpCjIPKN,13.0,10.0,Beau,,,,,,2017,6,25,16:07:47,2812,19317,https://pbs.twimg.com/media/DDLdUrqXYAMOVzY.jpg,1,vizsla,0.960513,True,miniature_pinscher,0.00943065,True,American_Staffordshire_terrier,0.0087113,True,vizsla
56,This is Snoopy. He's a proud #PrideMonthPuppo. Impeccable handwriting for not having thumbs. 13/10 would love back #PrideMonth https://t.co/lNZwgNO4gS,13.0,10.0,Snoopy,,,,puppo,puppo,2017,6,25,00:45:22,4319,19763,https://pbs.twimg.com/media/DDIKMXzW0AEibje.jpg,2,Italian_greyhound,0.734684,True,whippet,0.1504869999999999,True,Ibizan_hound,0.0397246,True,Italian_greyhound
57,"Meet Shadow. In an attempt to reach maximum zooming borkdrive, he tore his ACL. Still 13/10 tho. Help him out below

https://t.co/245xJJElsY https://t.co/lUiQH219v6",13.0,10.0,Shadow,,,,,,2017,6,23,16:00:04,1349,7913,https://pbs.twimg.com/media/DDBIX9QVYAAohGa.jpg,1,basset,0.32042,True,collie,0.215975,True,Appenzeller,0.1285069999999999,True,basset
58,This is Emmy. She was adopted today. Massive round of pupplause for Emmy and her new family. 14/10 for all involved https://t.co/cwtWnHMVpe,14.0,10.0,Emmy,,,,,,2017,6,23,01:10:23,7181,42876,https://pbs.twimg.com/media/DC98vABUIAA97pz.jpg,1,French_bulldog,0.839097,True,Boston_bull,0.0787993999999999,True,toy_terrier,0.0152433999999999,True,French_bulldog
59,This is Aja. She was just told she's a good dog. Suspicions confirmed. 13/10 would tell again https://t.co/lsPyyAiF1r,13.0,10.0,Aja,,,,,,2017,6,22,03:54:17,17300,71144,https://pbs.twimg.com/media/DC5YqoQW0AArOLH.jpg,2,Chesapeake_Bay_retriever,0.8379559999999999,True,Labrador_retriever,0.0620342,True,Weimaraner,0.0405991,True,Chesapeake_Bay_retriever
60,RT @rachel2195: @dog_rates the boyfriend and his soaking wet pupper h*cking love his new hat 14/10 https://t.co/dJx4Gzc50G,14.0,10.0,None,,,pupper,,pupper,2017,6,21,19:36:23,83,0,https://pbs.twimg.com/media/DCszHgmW0AAmIpT.jpg,1,Irish_setter,0.3647289999999999,True,golden_retriever,0.202907,True,Irish_terrier,0.107473,True,Irish_setter
61,This is Penny. She's both pupset and fired pup. Not pleased w your barbaric attempts at cleanliness. 12/10 would enjoy more shampoo options https://t.co/OYdDlfOGXP,12.0,10.0,Penny,,,,,,2017,6,21,15:58:08,3994,23258,https://pbs.twimg.com/media/DC20wEcW0AAf59m.jpg,1,basset,0.995368,True,Welsh_springer_spaniel,0.00193621,True,bathtub,0.000467919,False,basset
62,"Meet Dante. At first he wasn't a fan of his new raincoat, then he saw his reflection. H*ckin handsome. 13/10 for water resistant good boy https://t.co/SHRTIo5pxc",13.0,10.0,Dante,,,,,,2017,6,21,00:06:44,5414,27907,https://pbs.twimg.com/media/DCza_vtXkAQXGpC.jpg,1,Saluki,0.5099670000000001,True,Italian_greyhound,0.0904973,True,golden_retriever,0.0794058,True,Saluki
63,This is Nelly. He graduated with his dogtorate today. Wants to know if you're proud of him. 12/10 would give congratulatory boop https://t.co/4g4cfj3P4Y,12.0,10.0,Nelly,,,,,,2017,6,20,16:29:50,5880,27755,https://pbs.twimg.com/media/DCxyahJWsAAddSC.jpg,1,Pembroke,0.93112,True,Cardigan,0.0686982,True,basenji,8.17379e-05,True,Pembroke
64,This is Ginger. She's having a ruff Monday. Too many pupper things going on. H*ckin exhausting. 12/10 would snug passionately https://t.co/j211oCDRs6,12.0,10.0,Ginger,,,pupper,,pupper,2017,6,19,16:24:33,3506,21125,https://pbs.twimg.com/media/DCsnnZsVwAEfkyi.jpg,1,bloodhound,0.575751,True,redbone,0.24097,True,Tibetan_mastiff,0.0889348,True,bloodhound
65,This is Benedict. He wants to thank you for this delightful urban walk. Hopes you know he loves you. 13/10 super duper good boy https://t.co/26BXueUgbs,13.0,10.0,Benedict,,,,,,2017,6,18,16:57:37,2511,19163,https://pbs.twimg.com/media/DCnll_dUQAAkBdG.jpg,1,golden_retriever,0.874566,True,Irish_terrier,0.0373542,True,chow,0.0167235999999999,True,golden_retriever
66,"Meet Venti, a seemingly caffeinated puppoccino. She was just informed the weekend would include walks, pats and scritches. 13/10 much excite https://t.co/ejExJFq3ek",13.0,10.0,Venti,,,,,,2017,6,17,16:52:05,4903,28490,https://pbs.twimg.com/media/DCiavj_UwAAcXep.jpg,1,Bernese_mountain_dog,0.534327,True,Saint_Bernard,0.346312,True,Greater_Swiss_Mountain_dog,0.0949327,True,Bernese_mountain_dog
67,"This is Goose. He's a womanizer. Cheeky as h*ck, but also deep. Tongue slip game on another level. 13/10 will steal your girl https://t.co/V2WlACRJCN",13.0,10.0,Goose,,,,,,2017,6,16,16:11:53,4497,25773,https://pbs.twimg.com/media/DCdH8YpUQAAiEbL.jpg,1,Labrador_retriever,0.799551,True,Chesapeake_Bay_retriever,0.179975,True,vizsla,0.0046176,True,Labrador_retriever
68,Meet Nugget and Hank. Nugget took Hank's bone. Hank is wondering if you would please return it to him. Both 13/10 would not intervene https://t.co/ogith9ejNj,13.0,10.0,Nugget,,,,,,2017,6,15,00:13:52,5081,22185,https://pbs.twimg.com/ext_tw_video_thumb/875144175078957056/pu/img/BRi_l7vUdpb93Knf.jpg,1,Siberian_husky,0.245048,True,Pembroke,0.223716,True,dingo,0.160753,False,Siberian_husky
69,Guys please stop sending pictures without any dogs in th- oh never mind hello excuse me sir. 12/10 stealthy as h*ck https://t.co/brCQoqc8AW,12.0,10.0,None,,,,,,2017,6,14,16:04:48,4922,26022,https://pbs.twimg.com/media/DCSzF3NVoAAPzT4.jpg,2,West_Highland_white_terrier,0.7143189999999999,True,Siberian_husky,0.0919133,True,Great_Pyrenees,0.0460381999999999,True,West_Highland_white_terrier
70,Meet Cash. He hath acquired a stick. A very good stick tbh. 12/10 would pat head approvingly https://t.co/lZhtizkURD,12.0,10.0,Cash,,,,,,2017,6,13,17:29:20,4875,28439,https://pbs.twimg.com/media/DCN85nGUwAAzG_q.jpg,1,Labrador_retriever,0.836052,True,Staffordshire_bullterrier,0.0470690999999999,True,beagle,0.0360071,True,Labrador_retriever
71,This is Jed. He may be the fanciest pupper in the game right now. Knows it too. 13/10 would sign modeling contract https://t.co/0YplNnSMEm,13.0,10.0,Jed,,,pupper,,pupper,2017,6,12,16:06:11,4308,26651,https://pbs.twimg.com/media/DCIgSR0XgAANEOY.jpg,1,cocker_spaniel,0.437216,True,miniature_poodle,0.2771909999999999,True,toy_poodle,0.157402,True,cocker_spaniel
72,"I can't believe this keeps happening. This, is a birb taking a bath. We only rate dogs. Please only send dogs. Thank you... 12/10 https://t.co/pwY9PQhtP2",12.0,10.0,None,,,,,,2017,6,12,00:15:36,4125,23134,https://pbs.twimg.com/media/DCFGtdoXkAEsqIw.jpg,1,flat-coated_retriever,0.8321770000000001,True,black-and-tan_coonhound,0.0404369,True,Newfoundland,0.0282283,True,flat-coated_retriever
